titles,category
현대제철  세계일류상품   년 연속 최다 철강사    개 또 추가,Economic
수원 세모녀 사건 재발 막는다  위기 가구 발굴 시스템 정밀화,Economic
태양광 발전효율    배 쑥   한화큐셀   꿈의 태양광    서 개발지원,Economic
   억 찍었던 아파트  억 됐다  집값  또  역대 최대 폭락,Economic
화물연대 무기한 파업 돌입 정부  강력 대응 ,Economic
 주유소 기름 동내라   지침 정유업계  화물연대 파업에  긴장 ,Economic
정부  화물연대 총파업  명분 없는 이기적 행동  엄정대응 재차 강조,Economic
 주주총회 소집통지서  수령 거부  스마트폰으로 손쉽게,Economic
집값 하락폭  전주보다 커진       서울은 더 많이 내려,Economic
   억이던 게 지금은   상계동 새 아파트도  끝 모를 추락 ,Economic
보험 카드 사은품 상한 높인다,Economic
 규제완화도 무용지물  아파트값 역대 최대 하락 행진 지속,Economic
  온   시그넷  충전기 활용 전기차 배터리진단 서비스 개발,Economic
 급매물 위주로만 거래   전국 매매 전세가격 또 역대 최대 하락,Economic
금리인상 속도 늦춰도 집값 하락 여전 강북   억클럽 속속 탈락,Economic
최태원 회장이 말한  세포배양 연어육  회사    로부터    억 투자 받는다,Economic
충전만 해도 배터리 진단   온   시그넷  진단 서비스 사업 추진,Economic
감리원 허위 배치하고  레미콘엔 물 더 넣고 광주 붕괴사건에도 여전한  안전불감증 ,Economic
동원그룹  대표이사급 인사 실시   이명우 대표 부회장 승진,Economic
   라씨로  일회용품 규제 강화 대영포장 태림포장 등 골판지  강세,Economic
 퇴직연금 수령 확충하려면 세제 개선 필요 ,Economic
내년          전망 경제 뒷걸음질 불가피,Economic
집값 또 사상 최대 낙폭 노 도 강 영끌족 어쩌나,Economic
서울 아파트값   주째 내리막길          최대 하락폭 또 경신,Economic
이자폭등 비상인데  근저당 부동산    만건  금리상승기  뇌관  우려,Economic
이창용  금리인하 논의는 시기상조  고물가 고착화 방지 종합 ,Economic
렌터카 영업구역 규제 푼다 차 반납지서   일 내 대여 가능 종합 ,Economic
계약금 줄이고 이자후불제 계약조건 변경하는 신규 분양단지 주목,Economic
이창용 한은 총재   최종금리      전망 금리인하 논의는 시기상조 ,Economic
토스뱅크      억 유증 주주사에 하나카드 합류,Economic
이창용  최종금리      수준 금리인하 논의 시기상조 ,Economic
옛 소련    모스크비치  부활,Economic
세균 잡는  박테리오 파지  슈퍼 박테리아 잡는다,Economic
한은  기준금리        인상   내년 성장률      전망,Economic
  국민은행  티맵 대리기사 전용 소액 대출 출시,Economic
정부  화물연대 파업  심각해지면 업무개시명령 발동 ,Economic
케이프 이어 다올투자  증권사 구조조정 신호탄,Economic
  시그넷   온  전기차 충전 중  배터리 수명진단  공동추진,Economic
 넥타이 로 영끌족 위로하며 금리 올린 한은 총재  국민 고통 알아 ,Economic
긴축 부담 조금 던 코스피 모처럼 외국인 기관  동시 순매수 ,Economic
한은  내년 성장률 연      하향조정 취업시장도 한파 닥친다,Economic
충청권서    여명 집결해  파업 출정식  화물연대 파업 ,Economic
정부  청소년  극단 선택  막는다 은둔 청소년 생활비 지원 ,Economic
 분기 낸드플래시 매출     감소   하이닉스  위에서  위로,Economic
화물연대 총파업에 건설업계도 긴장    파업장기화시 피해 불가피 ,Economic
고팍스  코인예치  고파이  출금 전면중단   주 내 서비스 정상화 목표 ,Economic
한국은행  기준금리        인상   긴축 속도조절  내년   대 저성장 우려 ,Economic
  생활건강 역사 쓴 차석용 부회장    년만에 경영 마침표,Economic
이창용 총재  단기금융시장 경색 등 추가 대응책 필요시 유동성 지원  일문일답 ,Economic
정비사업 활발한 원도심   부동산시장도  르네상스  꿈꾼다,Economic
포카리스웨트도 오른다       편의점서     원     원,Economic
         년 국가채무비율      부가세 소득세 올려야 ,Economic
국민은행       대리기사 전용 비상금 대출 출시,Economic
삼성   자율운항 선박 해상 실증  성공 ,Economic
대만      산 버핏   비야디 지분은 추가 매각,Economic
이창용  내년  월까지   물가   통화정책 긴축 지속  종합 ,Economic
뉴노멀이 된  집콕  라이프에 더 넓게 쓰는 중대형 아파트 인기,Economic
고용장관  화물연대 파업에 국민적 우려 즉시 철회해야 ,Economic
 가백신 이상사례 신고  천건당    건 단가백신보다 낮아,Economic
   의 경고   고령화에     년 국가채무비율      ,Economic
기준금리 연              연속 인상,Economic
이복현 금감원장  금리인상에 따른 자금쏠림 감독 강화할 것 ,Economic
이창용  최종금리     가 대다수 금리인하 논의는 시기상조  종합 ,Economic
화물연대 전국서 총파업 돌입  안전운임제 일몰제 폐지 ,Economic
    경기 둔화  금리 상승에 한은  내년   성장률   대로 하락 ,Economic
이혼 전제로 별거 중인데  미리 재산분할 요구할 수 있나요,Economic
한은  내년 성장률     로       하향  물가는 내후년에도 목표치 상회  종합 ,Economic
한은  내년 경제성장률   대로 낮춰   경기 둔화 지속,Economic
  연준 실무진  경기 침체 경고   금리 급등 이후 최초,Economic
배우자 명의 이용  신고는 나 몰라라   허술한 국회의원 임대업 심사,Economic
 분기 임금 일자리   만 개   사상 첫     만 개 돌파,Economic
영무건설  군산 신역세권 예다음     가구 분양,Economic
   억 규모 무자본 갭투자  깡통전세  사기,Economic
쿠쿠홈시스  자사 최초 난방 가전  쿠쿠 카본 히터  출시,Economic
토스뱅크      억원 유상증자   하나카드   억 투자,Economic
지난해 숨은 보험금  조    억 원 주인 찾아 확인 방법은 ,Economic
휘발유 넘보는 등유 가격   정부  특별점검 나서,Economic
고용부  화물연대 총파업에 종합대책본부 현장지도반 구성,Economic
 부끄럽지만   남궁훈  먹통사태  방지책 발표 앞두고 심경 전해,Economic
   년    숙원 풀린다  납품단가 연동제  산자위 전체회의 통과,Economic
이창용         인상 만장일치 최종금리      전망이 최다 ,Economic
금감원장  금리 인상에  시장 예상 부합 자금쏠림 감독 강화 ,Economic
 함평 엘리체 시그니처    일 오픈 신축 브랜드 입지 프리미엄 누린다,Economic
 교체형 매트리스로 위생적인 수면 환경 완성하세요 ,Economic
이창용  금리인하 논의 시기상조 물가 목표수준 수렴해야  종합 ,Economic
포스코  올해 말 대부분 복구  대비 가능한 재난이었나,Economic
엄빠 먹는 약 반려동물도 제약사들 대표브랜드  털갈이  전략,Economic
 계열사 부당지원  조현범 한국타이어 회장실 압수수색,Economic
 소형 아파트가 대세    도심역 한양수자인 리버파인  전용          관심,Economic
정부  정당성 명분 없는 이기적 행동 자제해 달라 ,Economic
동원그룹  대표이사급 인사 단행 이명우 사장 부회장 승진,Economic
현대제철  세계일류상품   개 보유   년 연속 업계 최다,Economic
다올투자증권  정규직 대상 희망퇴직 실시,Economic
주총 배당 앞두고 늘어난 대차잔고 숏커버링 수혜주 노려볼까,Economic
월드컵  효자  만난  소비  깃발 매출 증가율      ,Economic
머스크   트위터 블루  추진 과정서 애플 구글과 충돌 가능성,Economic
  건설   장위자이 레디언트  분양 중도금 이자 전액 후불,Economic
겨우 재개했는데 둔촌주공  화물파업에 또 공사중단 위기,Economic
이창용  단기시장 금리  당황스러울 정도 모럴헤저드 막아야 ,Economic
  화학 한화 고려아연 트라피구라   중국 배터리 가치사슬 형성,Economic
발달장애인이 커피찌꺼기로 만든 친환경 연필   어떻게 팔 수 있을까 고민한다,Economic
 세계 경제  예상보단 덜 나쁠 것   낙관 이르다  경계도,Economic
이복현  기준금리 인상 시장예상에 부합 자금쏠림 최소화 해야 ,Economic
 르포   수출 물량 절반까지 늘린다  필립모리스 양산 공장 가보니  한경제의 신선한 경제 ,Economic
이창용  금통위원 대다수 최종금리 전망      인하 논의 시기상조  종합 ,Economic
이창용  진달래꽃 넥타이는 고통 받는 차주 위로 메시지 ,Economic
시멘트업계  화물연대 명분없는 불법파업 중단해야 ,Economic
한 미 일 유럽 자동차협회      보조금 적용 확대해달라 ,Economic
매출    억 눈앞에 둔 앳홈 뚝섬역 인근에 본사 확장 이전,Economic
       연내 압연공장   개 복구 예정 ,Economic
     년 국가채무비율       로 폭등     의 경고  정의진의 경제현미경 ,Economic
 최장수  차석용   생건 부회장 물러나 후임엔 이정애 부사장,Economic
이 총재    대 물가  변동성 커 대응 필요  베이비스텝 결정 이유 상보 ,Economic
이창용  과도한 한미금리 격차 바람직 않지만 국내요인 우선 ,Economic
한은 총재  최종금리      전망    금리인하 논의는 시기상조 ,Economic
화물연대 총파업 전국서 동시 출정식 첫날     참여,Economic
필립모리스 양산공장  일루마 전용 담배 제품  테리아  본격 생산,Economic
 연속 금리인상해       자금경색 우려에  베이비스텝  종합 ,Economic
위중증 엿새째    명대 신규확진  만  천여 명,Economic
양대노총   정부 노동정책  근로자 대부분이 부정적 ,Economic
정부  화물연대 총파업에 업무개시명령 예고  무관용 원칙 ,Economic
 르포  화물연대 파업에 부산항 물동량   분의   로,Economic
고령화 쓰나미          년 국가채무비율      넘을 수도 ,Economic
기준금리 또 올려       사상 첫  회 연속 인상,Economic
 경영능력 입증  정철동   이노텍 사장 부회장 승진 여부 촉각,Economic
레고랜드 자금경색에 금통위 선택은  베이비스텝 ,Economic
구조조정에 떠는 증권가   감원 칼바람 본격화,Economic
    년 국가채무비율            소득 부가세 실효세율 올려야 ,Economic
화물연대 무기한 총파업 돌입 정부  강경 대응 예고,Economic
     국가채무비율 낮추려면 소득세 부가세 실효세율    씩 올려야 ,Economic
코스닥    넘게 상승 한화솔루션  거래일째 상승,Economic
한은   연속 기준금리 인상 속도는  베이비 스텝 으로 늦춰,Economic
 배달원 못구하고  건강앱 먹통  확진자 급증에   방역  멘붕 ,Economic
  생건 차석용 부회장    년만에 퇴진  그룹 첫  사장 나왔다,Economic
 분기 임금 일자리   만개 늘었지만 절반은   세 이상,Economic
고령화 가속   복지 재원  감당 안될수도  증세 필요하다 ,Economic
화물연대  만여명 결국 운전대 놨다 철강 시멘트 줄줄이 발 묶이나,Economic
채권단   부릉  메쉬코리아 일부 주주 매각 반대에 법정관리 추진     일 결정 ,Economic
한은 총재  금리인하 논의 시기상조 최종금리           예상 ,Economic
정주영 열정 그대로    년 만에  포니 쿠페  되살린다,Economic
차고지 밖 렌터카 영업 허용   대기업 총수 친족 범위는 축소될 듯,Economic
수협  내년 금융지주 전환,Economic
화물연대 총파업 첫날 참여율     정부  운송개시명령  경고 종합 ,Economic
내년 성장률   대 하향전망 잇따라   경기침체 진입 시사,Economic
또 올렸지만 보폭 줄인 금리 자본유출   자금경색 사이 고육책,Economic
  화장품에 밀려난  설화수 후  광군제 매출   위권 밖으로,Economic
렌터카 서울서 빌려 부산 반납  요금 이제 내린다,Economic
 내보험 찾아줌  고마워  지난해 보험금    조 주인 찾아갔다,Economic
기준금리        인상 내년 성장 전망     ,Economic
 일문일답 원희룡  화물연대  민주당안 처리 요구하며    구성 불참 ,Economic
     재정여력 확충 위해 부가세 소득세 올려야 ,Economic
원희룡    를 통한 논의 거부한 것은 화물연대   업무개시명령 내릴 준비 됐다 ,Economic
         년 국가채무비율      부가세 소득세 올려야 ,Economic
 분기 임금 일자리     만개   증가폭 둔화 절반은   대 이상,Economic
 장사에 지문닳아 민원발급기 인식 안돼  모바일 대체인증 추진,Economic
 속보  이창용    월 물가상승률  상당 폭 낮아질 것 ,Economic
     인구감소 빨라지고 재량지출 더 늘면 국가채무비율     까지 확대 ,Economic
 고령화 최악의 시나리오      년 채무비율      ,Economic
 고령화 최악의 시나리오      년 채무비율      ,Economic
 르포    개월 복구 미완했지만    년만 폭우에 안전 지켰다   정상화 속도 내는 포항제철소  ,Economic
 분기 일자리      만 개 늘었지만  절반은   세 이상,Economic
    년 국가채무       전망 지방재정교부금 소득세 부가세율 개편 필요,Economic
정부  파업 명분없는 이기적 행동  사상 첫 운송개시명령 카드 준비,Economic
다올투자증권  정규직 대상 희망퇴직 임원들 사직서 제출,Economic
미      의사록  금리인상 속도조절  최종 금리는 예상보다 더 높을 듯,Economic
정부  화물연대 집단운송거부는 국가 경제 볼모로 한 이기적인 행동 ,Economic
고추 생산량  년 만에 최저 기상 악화에 병충해 확산 영향,Economic
고된 장사에 닳은 손가락  지문인식 안돼  고통,Economic
     재정확충 위해 소득세 부가세 각     인상 고려해야 ,Economic
 지문 닳아 무인서류발급 불편  모바일 대체수단 마련,Economic
임금근로 일자리 사상 첫     만개 넘어   만개  절반은   대 이상,Economic
 교부금 개편하고 소득 부가세 인상시     년 채무비율             ,Economic
  내보험 찾아줌  서비스에서 잊고 살던 보험금 찾아드립니다 ,Economic
 분기 일자리     만개 돌파 늘어난   만개 중       대 이상,Economic
원희룡  누가  무슨 자격으로 막나       우회없다 ,Economic
신차 대기만  년인데 개소세 인하 연장 한다  안 한다 ,Economic
공시가격 현실화 사실상 폐기 세금 얼마나 줄어드나 ,Economic
연내 압연라인   개중   개 복구  포스코  담금질 ,Economic
이한준   사장     만채 주택 공급  차질없이 추진할 것 ,Economic
     후폭풍  본격화 고팍스 원리금 지급 추가 지연,Economic
열 달 만에 문 닫는   페이  소액 해외주식서비스  왜 ,Economic
 서학개미는 지금  나스닥 상승    하락 기대 팽팽  배 레버리지  풀베팅 ,Economic
화물연대 파업 첫 날     여명 참여 전국 항만 장치율 평시 수준,Economic
워런 버핏    비야디 주식 또 매각 지분 축소,Economic
  온    시그넷과 전기차 배터리 진단 서비스 개발 나서 내년 도입,Economic
한은  내년 경제성장률 전망           대폭 하향,Economic
고팍스  결국 코인예치 서비스  고파이  출금 전면중단 사태,Economic
 현장   담배연기 없는 미래  꿈꾼다는  필립모리스    양산공장 가보니,Economic
 화물연대 파업 피해 이번엔 더 심각  산업계 비상대책 가동 종합 ,Economic
전성기 이끈 미켈레  구찌와 결별    년 특별한 여정 끝내 ,Economic
   파산에 고팍스 결국 고파이 출금 지연  주내 정상화할 것,Economic
이재용 회장  상무 시절 데뷔 무대       년만에 다시 찾나,Economic
  내부서도  중진국 함정 빠질수도 경제 정상궤도 되돌려야 ,Economic
 금리인상  증시 단기영향 제한적 자금시장 안정은 시간걸려 ,Economic
원희룡  화물연대  명분 없는 이기적 행동 운송개시 명령 발동 준비 착수 ,Economic
포카리도 데미소다도 오른다 식품업계 줄줄이 가격 인상,Economic
원희룡 장관  화물연대 총파업에  업무개시명령  등 강경 대응 예고,Economic
쏘카 보험 카드 등   개 규제 푼다 대형마트 의무휴업은 제외,Economic
화물연대 총파업 돌입 둔춘 주공 내일부터 공사중단 위기,Economic
  중공업  해군 고속정  척 수주,Economic
 짐싸고 나갈 사람이  개월째 원장역 지속  리더십 공백에 대덕특구  어수선 ,Economic
야당 반대로 종부세 못 내려 재산세 인하  플랜   가동,Economic
정부  화물연대 파업  심각해지면 업무개시명령 발동 ,Economic
한은  베이비 스텝 도     조 가계빚엔  이자폭탄 ,Economic
원희룡  화물연대 정당성 없다 운송개시명령 발동 준비 ,Economic
 최대 곡창지대  전쟁 길어지자 뉴욕증시 농기계  위 기업에 쏠린 눈,Economic
  중앙은행    일부터 시장안정 위해 사들였던 국채 매각,Economic
원희룡  화물연대  이기적인 운송거부 강행 불법엔 무관용 ,Economic
    러시아 원유 가격상한제 합의 실패 협상 난항,Economic
한국은행  기준금리         사상 첫  회 연속 인상,Economic
아모레퍼시픽  한한령 해제 수혜 받나   증권가  분기 반등 기대론  솔솔 ,Economic
주식서 탈출 러시   자산시장 판도 변화,Economic
한국은행  기준금리        인상      로 마무리,Economic
이창용  최종금리 금통위원 의견 제각각      대다수 ,Economic
한은 총재  금리인하 논의 시기상조 물가 목표수준 수렴해야 ,Economic
금감원장  금리인상  예상에 부합 자금쏠림 감독 강화 ,Economic
연이은 금리 인상  부메랑    돈 줄 마른 기업  고난의 행군,Economic
 태풍 매미 때도 안한 고로 중지를   포스코가 직접 밝힌  힌남노 그날 ,Economic
울산서도 화물연대 파업 출정식 현대차  탁송에 직원 투입,Economic
 현장연결  한은총재  금통위원 전원 일치로        인상 결정 ,Economic
 속보 이창용  부동산 관련      쏠림 현상 계속 금리 급등 과도 ,Economic
  생건  첫     로 분위기 쇄신 차석용 부회장  후진 위해 용퇴  종합 ,Economic
 속보  이창용  최종금리 전망 연     가 가장 많아 ,Economic
버크셔        주식 추가 매각 버핏은  조원 기부,Economic
  생활건강   년 이끈  차석용 매직  최장수     내려놓다,Economic
 작년 찾아간 숨은보험금만  조 천억원 올해도 찾아가세요 ,Economic
화물연대 파업에 제철소 철강재 출하 중단   포스코 현대제철  만  이상,Economic
내년 경제성장률   대 추락   공식화한 경기침체,Economic
한은  사상 첫  차례 금리 인상  베이비스텝  속도 줄였지만 이자 부담 ,Economic
대전 세종    에 승객 태운 자율주행 버스 달린다,Economic
서울서 빌린    대전서 반납해도  수수료 폭탄  없다,Economic
서울시  반지하 지상층 이주 시  년간 월   만원 지원,Economic
이복현  기준금리 인상에  자금쏠림 감독 강화할 것 ,Economic
 숨만 쉬고 살아도 남는 게 없네    생활비 아껴주는 신용카드  눈길 ,Economic
     화학부문 인적분할 추진    기업가치 재부각 기회될 것 ,Economic
화물연대 파업에 철강 운송차질 현대제철  천톤 출하 못해,Economic
봇물 터진       대형사로 더 쏠렸다,Economic
한한령 해제 기대감에 관련주 줄줄이 급등   허와 실은 ,Economic
 세 모녀 사건  더 이상 없다   정부     위기가구 지원책  발표,Economic
보험 카드 사은품 늘어난다 마트 새벽배송 허용은 보류,Economic
 경쟁사도 시민도  수해 복구  합심   정상화 속도 내는 포항제철소  ,Economic
가뭄 전쟁  식량위기 악화에  각국  유전자 변형 작물  허용 움직임,Economic
채권금리  금통위 이후 하락세 주식시장은  무덤덤 ,Economic
  카타르 월드컵 첫 경기 거리 응원 수혜주는  잠잠 ,Economic
카셰어링 영업구역 제한 풀린다  편도 이동 후 원하는 곳에 반납 ,Economic
정부  화물연대 집단운송거부  정당성 명분 없는 이기적 행동 ,Economic
  번째 기준금리 인상  한은 총재  물가 목표 수렴 확신할 때 금리 인하 논의 ,Economic
증권가 구조조정 칼바람   다올투자증권  정규직 희망퇴직,Economic
 르포 필립모리스  심장 을 가다 일루마  위 탈환 비책될까,Economic
백화점  사  크리스마스 장식  철통 보안  유지  마침내 모두 공개,Economic
 현장연결  정부  화물연대 운송거부 철회 촉구 담화문 발표,Economic
  전자 인사에 쏠리는 눈  변화보다 안정  이어질까,Economic
 단독    생건  영유아 식품사업 접는다   년 만에 분유 철수,Economic
  화물연대 파업에 정부가 합의안 파기 안전운임 대상 확대법 추진 ,Economic
기아차 근로자들  통상임금  차 소송도 승소,Economic
화물연대   개 지부 파업 출정식   거점 항만 등 물류대란 비상,Economic
 한은 베이비스텝엔 안도 부동산시장 반전은 어려워 ,Economic
다올   희망퇴직 단행 경영 상무급 임원들 사직서 제출,Economic
차량 직접 운전 탁송 야드 트랙터 도로 운행 등 비상수송대책,Economic
벌써 세번째 희망퇴직 연말 여의도 칼바람 시작됐나,Economic
  건설   장위자이 레디언트  분양 중도금 이자 후불제,Economic
정부  운송방해 행위  끝까지 추적 무관용 대응  화물연대 파업 담화문,Economic
 주식 초고수는 지금  한화   화학과 파트너쉽 고려아연 성장성 부각,Economic
기준금리 올랐는데 은행들 예적금 금리 인상  눈치게임 ,Economic
 블프 시즌  해외직구족 들썩,Economic
부산 오시리아   자율차 시범운행지구  됐다,Economic
 속보  이창용         금리인상 결정 금통위원 만장일치 ,Economic
 응원엔 치맥이지  치킨업계  월드컵  경기 앞두고 판매 총력전,Economic
 현장영상   한은  기준금리        인상    불확실성 여전 ,Economic
서민연료 등유 휘발유보다 비싸다  당     원대,Economic
   미국산 차 보조금지원 언급조차 안했다,Economic
차석용 부회장 용퇴     생건  그룹 첫 여성 사장,Economic
 정부     년 원전 비중     확정 시민단체 반발 예고,Economic
태우지 않는 담배  어떻게 만들어지나 필립모리스 양산공장 가보니  르포 ,Economic
 르포  포스코는 포기하지 않았다  수해현장 가보니 ,Economic
 종목속으로  메리츠     뭉치니 살았다,Economic
 팀장시각  화물연대 파업이 침체를 부추기는 이유,Economic
메쉬코리아  대출만기 늘려주면 정상화 가능 ,Economic
이정애    그룹 첫 여성 사장 차석용   생활건강 부회장  용퇴   종합 ,Economic
 지금은 드려도 내년엔 안돼요  비닐봉지 금지 첫날 곳곳 혼란,Economic
  이르면   일 지준율        인하 발표   금리축소 유동성 동시 해결,Economic
포스코  압연라인  곳 복구   곳도 곧 가동 ,Economic
삼성    테일러 부지 선정  년     나노  구축 본격화,Economic
원희룡  화물연대 총파업  심각할 경우  업무개시명령  발동 검토 ,Economic
정부  파업 미참여 노동자 방해 협박 시 끝까지 추적 엄벌 ,Economic
조제용 감기약 가격   원 최대   원   업계  아쉽다 ,Economic
기준금리        인상        인당 이자부담    만원 늘어난다,Economic
카바나  경영진 대량 주식 매수   바닥 신호   영상 ,Economic
원희룡  화물연대에 운송개시명령 발동 준비 착수 ,Economic
서울시  반지하 이주 본격화 이주시 월   만원 지원,Economic
 전문  한은  고물가에 기준금리 인상 지속    대 성장세 둔화 ,Economic
여의도 증권가 구조조정  칼바람     다올투자증권 희망퇴직 단행,Economic
올해 마지막 금통위 통방문 문구 어떻게 달라졌나,Economic
   첫 여성     탄생 화장품  후   조 매출 이끈 이정애,Economic
한은  성장률 낮아지나 금리인상 당분간 지속 ,Economic
대영포장 태림포장 등 제지주 동반 급등   일회용품 금지 수혜 부각,Economic
원희룡  운송개시명령 준비 착수 곧 국무회의 상정할 것 ,Economic
아듀  구찌 알렉산더 미켈레  후임은 마티유   명품톡  ,Economic
 문답 서울시 반지하 대책  전세로 옮겨도 월   만원 지원한다,Economic
서울시  반지하 가구 지상층 이주시  년간 월   만원 지원,Economic
명문대 인접해  대세권  누리는  빌리브 디 에이블 ,Economic
반지하서 이사하면  년간 월세   만원 준다 자격조건은 ,Economic
 크리스마스 한달 앞  백화점 연말 장식 경쟁   사  색 ,Economic
