titles,category
멈춰선 화물차  줄 선 천막들  봉쇄투쟁  없었지만 긴장,Social
 주간 뉴스타파  이태원 참사  산 자의 눈물과 국가의 의무,Social
방치  방해  거짓말     이태원 참사  유족이 말하는  윤석열 정부의 잘못 ,Social
 기자가 왜 대통령 전용기 타나  문제 제기 헌법소원  요건 미비  각하,Social
붉은 악마로 가득찬 광화문 광장   경기  시간 전부터 응원 열기 후끈,Social
 대 한민국   광화문에 울려 퍼진 붉은 함성    년 전과 달라진 모습,Social
 왜 비싼 봉투를 사요       일회용품 금지  첫날 곳곳서 옥신각신,Social
 조두순 안산 떠나라 이웃으로 못 받아들여  주민들 반발,Social
이태원  세 개의 길  그리고 밤   시   분,Social
축의금 논쟁  활활   만원 냈더니  내가 서운하게 한거 있어  ,Social
비닐봉투 종이컵 일회용품 금지 첫날 일부 혼선도,Social
화물연대  정부의 업무개시명령은 반헌법적 엄포 중단해야  종합 ,Social
기초 수급비 적다고 주민센터서 분신 위협,Social
손님으로 가장해 노래방서 절도 돈 봉투 지문에 덜미,Social
 오늘의 판결  여자가 된 아빠    냉동육이 신선육    군 종교행사 강요 위헌 ,Social
광화문광장에서 월드컵 거리응원    안전사고 예방 ,Social
조두순  회사원  속이더니 이사 포기 위약금까지 챙겼다,Social
 기초수급비가 왜 이리 적어    대 남성 주민센터서 분신 시도,Social
 년 방치된 여아 시신 머리뼈에 구멍 친모 친정집 압수수색,Social
 여인선이 간다 소음에  술판에  시위 날엔 장사 포기 ,Social
 안전운임제 확대 정착  화물연대 총파업 정부는  엄중 경고 ,Social
만취   대가 몰던 마티즈에 깔린 할머니 시민들이 구했다,Social
 이슈   김여정  윤대통령 향해 막말 비난  서울 과녁  위협도  ,Social
 대한민국 파이팅  안전 우려 속 첫 광화문 거리응원 시작,Social
전 서울청 정보부장 등 줄소환 김광호 서울청장 곧 조사,Social
 단독  이정근 말고  명 더 있다 민주당 인사 근무지 된     상근고문직 ,Social
거짓말로 밝혀진  청담동 술자리  의혹  어텐션 뉴스 ,Social
만취 차량에 깔린 할머니 시민들  차량  번쩍  들어올려 구조,Social
 뉴스추적  이재명 수사 시작   정진상 구속적부심 기각    김만배 입  주목,Social
 단독 쌍방울    공장서 북 인력 고용 정황,Social
농협중앙회장의  친위 쿠데타 ,Social
유산 때문에 친누나 목조른 남동생  살인미수 혐의로 체포,Social
석방된 김만배  법률적 판단 떠나 죄송   그분  질문에는 침묵,Social
 남편은 회사원  속인 조두순 아내 위약금 받고 이사 무산,Social
 녹음파일 공개 협업  김의겸 소환 검토,Social
서울중앙지법원장 후보에 송경근 반정우 김정중 추천,Social
화물연대 총파업 돌입 정부  불법 엄단  천명,Social
이재명 대표 가족 계좌 추적 수사 본격화 조짐,Social
 유령직원 만    명 고용지원금   억 원  꿀꺽 ,Social
 정말 잠만 잤다  아내 무인텔 드나든 기록으로 이혼소송 가능할까 ,Social
교육감들  교원 늘려 달라  교사 보직수당 인상 요구,Social
대법  미성년 자녀 둔 성전환자도  성별 정정  가능 ,Social
 일몰제 폐지해야 멈춘 물류 다시 움직인다 ,Social
벌써 출하 차질  파업 장기화 땐 수조 원대 피해  글로벌 선사  부산항 패싱  우려,Social
  그룹 수사해온 서울중앙지검  알펜시아 사건 도 수사,Social
 단독     오송역 대광로제비앙 입주 예정자들  일방 연기에  분통 ,Social
왜 군인만 이러한 곤경을 겪어야 하는가  김형남의 갑을 병정 ,Social
소환조사 불발 하루 만에  서해 피격  서훈  검찰 출석,Social
민변  정부  이태원 참사 유가족 요구 설문조사 유감 ,Social
 청담동서 술자리  거짓말이었다  진술 김의겸은  유감 ,Social
화물연대 총파업 광주 전남  천 명 참여  물류 차질 불가피,Social
 개월 만에 또 화물차 봉쇄  철강 시멘트 운송 차질 시작  화물연대 파업 돌입 ,Social
광주  군공항 이전  후보에 함평도 들어가나,Social
정부  이태원 희생자 명단공개는 돼도 유족 진상규명 참여 안된다,Social
한인  명 인도네시아 현지       오디션 진행 중 이민법 위반 체포,Social
     편파 변제  보도 서경석 개발공사 사장 사퇴,Social
온실가스 덜 내뿜는 기업에 배출권 더 주고 거래 활성화 종합 ,Social
성범죄자 조두순    일 이사 포기 다른 지역 옮길 가능성 있어,Social
화물연대에 감협 노조까지   감귤 유통 어쩌나,Social
  공항 건설 기정 사실화   논란 속 공청회 열려,Social
자녀  명 살해시도   대 엄마  집행유예  검찰 항소 포기  왜 ,Social
전국 곳곳  대 한민국  응원전 준비 완료,Social
파업으로 멈춰선 화물차 시멘트 대란 우려,Social
경북 구미칠곡 축협 이사 선거  돈 줄테니 선거 나오지마 ,Social
광화문광장 거리응원에 속속 모이는 붉은악마 응원 열기 고조,Social
 술자리 의혹  허위 판명에 한동훈  김의겸 사과 필요 없고 법적 책임 묻겠다 ,Social
청주국제공항  향후   년 생사 갈림길  정부 지원 시급 ,Social
오랜만에  대 한민국   이시각 광화문,Social
냉장육 얼린 뒤  유통기한  년  표기하면    대법  허위 표시 ,Social
 축구 끝나니 치킨 도착    오늘 야식 언제 시키지 ,Social
어제는 병원  오늘은 화물  내일은 학교 파업 더 커진다 종합 보 ,Social
 슬슬 추워지는데  이달 도시가스비 청구서에  허걱 ,Social
대법원  미성년 자녀 둔 성전환자  성별정정 불허는 차별 편견 고착화하는 것 ,Social
   사실상 이재명 강제수사 돌입  김만배  입 에 주목,Social
 역대 최장     일 만에 대법관 된 오석준  초심 잃지 않겠다 ,Social
민주노총  도미노  파업 노정 갈등  최고조 ,Social
화물연대 총파업 돌입  불법 엄단  강대강 대치,Social
이재명 대표 계좌추적 김용 대선자금 받을 때 현금  억 입금,Social
  년 동거녀 얼굴 수차례 찌른   대 징역  년,Social
음주운전 차량에 깔린 할머니  시민들이 구조,Social
중앙선관위  대선  소쿠리 투표  책임자  정직    개월  징계,Social
화물연대  정부의 업무개시명령은 반헌법적 엄포 중단해야 ,Social
이재명 자택  억대 현금  포착  강제수사 퍼즐 맞춰가는  ,Social
다시 멈춘 물류   화물연대  개월만에 무기한 총파업,Social
거짓으로 드러난  술자리 의혹  한동훈  이제 책임질 시간 ,Social
 장애인 위해 써달라  청주시에  억원 쾌척한 익명의 천사,Social
경찰  채증 항의한 금속노조 지회장 강제 연행   노조 측  과잉 진압 ,Social
음주차량에 깔린 할머니 시민 도움으로 구조,Social
화물연대 파업 돌입     업무개시명령 검토  국토부에 노조  대책 없는 협박 ,Social
무면허 음주운전 차량에 깔린 할머니 시민들이 차 들어올려 구조,Social
지팡이 짚은 노인이  억원을 내밀었다  장애아동 위해 써주세요 ,Social
검찰   후원금 유용 의혹  강용석 자택 가세연 사무실 압수수색,Social
 녹색  치매 예방과 치료에 좋은 국산 참기름,Social
 단독  현대건설    현대산업개발  포항 아파트서  조원 넘는 돈 벌면서 태풍 수재의연금 기부는    ,Social
  개월 딸 시신 김치통에 숨긴 부부 아이 머리 뼈엔 구멍,Social
첼리스트 통화  가짜  김의겸  심심한 유감 ,Social
 단독 도시철도 무임수송 국비보전 길 열렸다   국회 국토위     억원 편성,Social
    선거법 위반 혐의  강용석 자택 압수수색,Social
해운대 개발 역사 담긴  재송동 모텔촌  역사 속으로,Social
내일부터 청계천서 자율주행버스 탄다 최대  명 무료탑승,Social
국토 차관 화물연대 위원장  총파업 첫날 면담 입장차 확인,Social
화물연대  부산 평택항 포함 물류거점 봉쇄 시도     시멘트 운송 막혔다 ,Social
 막차는 언제   우루과이 거리응원  이거하나면 끝 ,Social
리듬체조 코치  물도 먹지 마  화장실도 가지 마 ,Social
뇌 망가뜨리는 주범 미세먼지      로 첫 확인,Social
혼잡한 청계천 달리는 자율주행버스  내일부터 정식 운행  최대  명 무료탑승,Social
    뉴스파이터  반말에 복수하는 방법  갑론을박,Social
특수본  서울청 정보부장 소환  인파 위험  보고서 삭제 지시 경위 추궁,Social
일본 규슈에서 한국 순천만 찾은  흑두루미   만 마리  왜 ,Social
잠 못 자고 운전대 잡던 시절 또 오나 화물기사들은 묻는다,Social
전국   곳서 동시다발 출정식  무기한 운송 거부 ,Social
검찰  허희수     부사장 소환  계열사 부당 지원 의혹,Social
서울대 보라매 병원 노조  사측의 교섭 거부로 무기한 파업 결정 ,Social
광주 학교 비정규직 총파업에    개 학교 대체급식 운영,Social
지역주민 홀대논란 태백호텔  지역주민 고용 제로 ,Social
이태원 참사 검은 날들을 보내며 묻는다,Social
  대 무면허 음주운전 차에 깔린 할머니  시민들이 차 들어올려,Social
탈모약  아직도 고민만 하고 계신가요   약 읽어주는 안경진 기자 ,Social
 현장 연결  화물연대 파업 첫날 강대강 치닫는 노정 갈등,Social
헌재  아동 성희롱범  공무원 임용 영구 제한은 헌법불합치 ,Social
기아  수백억 원대 통상임금  차 소송도  패소 ,Social
   조현범 한국타이어 회장 정조준 부당지원 압수수색,Social
화물연대 파업 첫날  정부  업무개시명령 으로 맞불 종합  ,Social
        계열사 부당지원 배임 의혹  허희수 부사장 소환 조사,Social
정진상 구속적부심 기각  검찰  이재명 수사 탄력,Social
 이브닝 스프  궁지 몰린 김의겸  반격하는 국민의힘,Social
 경찰 채증 반발  금속노조 지회장  체포  시간만에 석방,Social
 직업교육 받고 일자리 얻어  새 삶 사는데 자신감 생겼어요   주홍글씨 벗는 사람들 ,Social
삼풍 우성 차 재건축 쉬워진다   서초 이수 아파트지구 해제,Social
화물연대  국토교통부는 업무개시명령 엄포 중단하라 ,Social
가로수길 대규모 개발 제한한다   저층 중심의 상권 다양화 유도,Social
 건강 팁  치료제 없는  근감소증  꾸준한 근력운동 영양보충으로 예방해야,Social
 투기의혹  서경석 전북개발공사 사장  돌연 사의 표명,Social
허위서류로 피의자 체포 구속했다가 법정 서게 된 경찰관,Social
경찰    개월 딸 시신  년간 숨긴 친모 자택 압수수색,Social
 청담동 술자리 제보 거짓  진술에  김의겸   대통령 등에게 유감 ,Social
한동훈   청담동 술자리  의혹에  저질 음모론 부추긴 이재명 사과 요구 ,Social
정진상 구속 유지 이재명 계좌 추적  날 선  ,Social
   첫 대법관  오석준  초심 잃지 않겠다     일만에 인준,Social
 장애인 도와줬으면  청주 찾아  억원 기부한   월의 산타,Social
    서해 피격  서훈 전 국가안보실장 소환   구속영장 검토,Social
병원서 철도 학교 노조까지 거세지는 대정부 투쟁,Social
오석준 대법관 임명동의안 통과,Social
   이사람   국가인재  서 적임자 찾을 때 가장 큰 보람 ,Social
 르포  파업현장서 정치구호 난무 인천항 화물 반출입    이상 급감,Social
   개월 딸 시신 김치통 보관  친모 자택 친정집에 경찰 압수수색,Social
검찰  이재명 계좌 추적   돈 종착지  규명 착수,Social
베란다서 비둘기떼 먹이주는 아랫집  내 집인데 무슨 상관 ,Social
경제 비상인데  결국 물류는 멈췄다  화물연대 파업 돌입 ,Social
대구지하철노조  구조조정 민영화 방침 철회하라  내달  일 파업 예고,Social
특수본   보고서 삭제 의혹  서울청 정보부장 소환 이임재는  차 출석,Social
검찰  허희수     부사장 조사 세습 위한  계열사 부당지원  의혹,Social
편의점 식당 일회용품 금지 확대 갑작스러운 계도 기간에 지자체 당황,Social
한동훈 장관  저질 음모론 부추긴 이재명 등에 사과 요구 ,Social
이재명으로 향하는   칼날 계좌 추적 측근 구속적부심 기각,Social
 디지털성범죄 피해자  일상회복까지 책임진다 ,Social
        아버지 유산 문제로  친누나 폭행한 동생  살인 미수로 체포,Social
 보고서 삭제 지시  전 서울청 정보부장 조사   특수본  김광호도 곧 소환 ,Social
한동훈  저질 음모론 부추긴 이재명 사과하라 김의겸은 법적 책임 ,Social
오석준 임명동의안 통과 석 달 끈  대법관 공석 사태  종료,Social
 내일날씨  수도권 등 퇴근길 비  우산 챙기세요,Social
경기남부도 뚫렸다 무섭게 번지는   ,Social
화물연대  업무개시명령 강제노동명령 ,Social
코로나로  확찐    대 남성   명 중  명이 비만,Social
서울시  반지하에서 지상으로 이사하면 월   만원 지원    만     가구 대상,Social
 대형사업 행정처리 지연 피해 커져  시민단체  구리시 감사청구,Social
    서해 피격  서훈 전 국가안보실장 소환    윗선  수사 본격화,Social
촛불중고생연대가  피혐의자  수사 대상  경찰  오보 ,Social
미성년 자녀 둔 성전환자 대법  성별 변경 허용  종합 보 ,Social
 육군훈련소 종교행사 참석 강제는 위헌 ,Social
화물노동자 자영업자라면서  업무개시 명령 으로 압박하는 국토부,Social
수출항 틀어막은 화물연대   시멘트 부족에 건설현장 올스톱 위기,Social
 이재명 최측근  정진상 구속 유지    관여 여부  수사도 속도낼듯,Social
화천군  지역 떠나는 이기자부대 지휘관들과 마지막 인사,Social
검찰  이재명 계좌 추적 착수   경선 자금  정조준,Social
국토부  택시부제 전면해제  대구시  야간에만 해제  계획 차질,Social
정진상 구속적부심 기각    이재명 계좌  추척,Social
   신고   앱 으로 자동 전파    보고 지연 누락 막는다,Social
검찰  강용석 자택 등 압수수색    공직선거법 위반  혐의,Social
학교비정규직노조   일 총파업  광주     전남    개교 대체급식 종합 ,Social
 미성년자 빚 대물림  막는다 민법 개정안 국회 통과,Social
     강원도 캐릭터 범이 곰이 사용중단   저작권 침해 주장,Social
허위 수사기록 만들어 특진한 경찰관 기소,Social
 대 한민국  광화문 거리응원에    구급 구조대  개대 배치,Social
  외과응급의료체계 구축  응급수술 인프라 투자 필요 ,Social
 수원 세 모녀  비극 막는다 채무 질병 정보 살펴 위기가구 발굴,Social
고양시  고양시가 테슬라 기가팩토리 유치 최적지 ,Social
오늘 밤 광화문광장 거리응원 서울시  대중교통 증편 연장,Social
대법   미성년 자녀 둔 성전환자  성별 정정 허용해야 ,Social
조두순 결국 이사 안 간다 보증금에 계약 파기 위약금까지 돌려 받아,Social
미래준비 나선 구광모   변화 혁신 시동걸었다,Social
헌재  육군훈련소 종교행사 참석 강제는 위헌 종교의 자유 침해 ,Social
 기자가 왜 대통령 전용기를 타나  헌법소원 헌재  요건 부족  각하,Social
학교 비정규직   일 하루 총파업 부산    개 학교 급식 중단,Social
보이스피싱 조직이 현금 수거책 경찰에 신고  먹튀 하자 보복,Social
철도노조 태업 첫날 무궁화 새마을호   대 최대   분 지연 종합 ,Social
피싱 사기 의심받자  마약 산 것  털어놓은   대 구속,Social
검찰  강용석 집과 사무실 압수수색    선거법 위반 혐의,Social
검찰   경영권 부당 승계 의혹  허희수    부사장 소환,Social
일본서 탈출한 흑두루미  만마리 어쩌나   순천만     서식지 과밀  비상,Social
멈춰선 화물차  만     여명 파업에 물류 대란 오나,Social
참사 현장 노출한 언론  유가족 회견은  흐림 처리 ,Social
  이노텍 실적 이끈  광학솔루션  조지태 노승원 전무 승진,Social
 기자가 왜 대통령 전용기 타나  시민이 제기한 헌법소원 각하,Social
코로나로 단기 일자리로 내몰린 제주 청년들  한은  위험신호 ,Social
한동훈  김의겸 향해  사과 필요없고  해코지 못하게 법적 책임져야 ,Social
경찰이 극단선택 부추기자 화 못 참고 경찰 머리 내려친   대,Social
 심층  화물연대 총파업 지역서도 진행,Social
 이슈체크  화물연대 총파업 돌입 정부  불법 엄단  강대강 대치,Social
월드컵 거리 응원하기 좋은 밤 날씨 전국 대체로 맑음,Social
 년간 숨긴 딸 시신 머리에 구멍  경찰  친모 자택 등 압수수색,Social
조두순  위약금 받고 이사 포기    현재 집에서  년 더 거주할 듯,Social
경찰 채증 반발한 금속노조 지회장  체포됐다  시간만에 석방,Social
화물연대 파업 첫날 곳곳서 운송 차질 기업 피해 가시화 종합 ,Social
화물연대 총파업 전국서 출정식 첫날 인천항 화물 반출입량     감소,Social
조주빈 강훈   강제추행  유죄 징역  개월 추가  가상기자 뉴스픽 ,Social
철도노조 태업 일부 열차 평균   분 지연     정상운행 종합 ,Social
오영훈 제주지사  선거법 기소는 정치 탄압 ,Social
 현금  억  든 종이가방 내밀고선   대  장애인 위해 써달라 ,Social
   강용석 자택 압수수색  선거법 위반  등 혐의,Social
검찰   허위사실 공표 혐의 우범기 전주시장 불기소,Social
기상청 퇴직공무원  직원 자녀 장학금  억원 기부,Social
 탈모약  해외 직구했을 뿐인데  불법의약품 구매로 처벌 대상 ,Social
 자막뉴스   눈물이 쏙 들어가고 소름이 쫙  위로해 준 친구 사진에 찍힌 것,Social
 어르신  아이 모두 살기 좋은 영도 위해  주민이 선정한  대 정책은 ,Social
광주 전남 주택   채 중  채는 빈집,Social
청주서 얼굴없는   대 천사가  억원 기부,Social
탈모약  아직도 고민만 하고 계신가요   약 읽어주는 안경진 기자 ,Social
 대장동 자금  관련 이재명 계좌추적 민주  망신주기 수사 ,Social
우리나라 주  시간제  트위터코리아 고용 중단 시킬까,Social
안산시 선부동 이사 무산된 조두순 어디로 위약금    만원 받아,Social
물류도  대화도 꽉 막혔다 정부는  엄정 대응 만 되풀이,Social
 월 단체 반발에 홍준표 시장 민주묘지 참배 취소 종합 ,Social
 계열사 부당 지원 혐의      차남 허희수 부사장 검찰 소환,Social
오석준 대법관 동의안    일만에 국회 통과,Social
   년 표류  거제 장목관광단지      년 첫 삽 뜨나,Social
 농협중앙회  회장 연임  회 허용  설문조사 중단해야 ,Social
투신사고 방지  논란의 인천대교 드럼통,Social
법원  재차  정진상 구속 정당  무색해진 이재명  무검유죄 ,Social
대법   토지보상금 압류  소유주도 증액 소송권 인정,Social
대법   토지보상금 압류  소유주도 증액 소송권 인정,Social
지붕서 추락한 근로자 사망 안전조치 의무 안 한 대표에 실형,Social
한동훈  저질 음모론 부추긴 이재명 등 사과해야   김의겸은 법적책임  종합 ,Social
한동훈 장관  저질 음모론 부추긴 이재명 등에 사과 요구 김의겸 법적 책임져야 ,Social
검찰  선거법 정치자금법 위반 혐의 강용석 자택 등 압수수색,Social
대구 경북 화물연대  국회 통과 때까지 무기한 파업 ,Social
화물차 수 백대 오가던 의왕   도 멈췄다 수도권 물류비상,Social
유령직원 올려 고용보조금    경찰이 놓친   억  검찰이 찾아냈다,Social
주   회 무인텔에 쉬러 간다는 아내  나 못믿냐  되묻는데 어찌하리오,Social
검찰  강용석 자택 사무실 등 압수수색 정치자금법 위반 등,Social
 조두순  안산 떠나라   분노한 안산시 여성단체,Social
 영상  화물연대 오늘부터 무기한 총파업 정부와 강대강 대치,Social
박완수 도지사  윤 대통령에 경남 방산 정책현안 건의,Social
문화체육관광위원회   광화문광장 월드컵 거리 응원  안전관리에 총력 당부,Social
 르포 화물 파업 첫날   봉쇄 는 없었지만   일부 지역선 경찰과  충돌 ,Social
오석준 임명동의안 통과 석 달 끈  대법관 공석 사태  종료,Social
 정진상   공단 분리 초과이익 환수 삭제 편의 제공    구속영장 곳곳에서 이재명 겨눈 검찰,Social
대구 남성 육아 휴직  년 만에     급증 일 가정 균형 중요 인식 확산,Social
병적인 집착  스토킹   피해상담 느는 제주,Social
대법원  두달 반 만에 정상화 오석준 대법관 임명동의안 가결,Social
 아동 성범죄자 공무원 임용금지  헌법불합치 결정,Social
헌재  아동 성적 학대 전과자 임용 제한한 국가공무원법 고쳐야 ,Social
조두순  이사 가려다 결국 포기 새 집주인이 위약금    만원 줬다,Social
  만난 박완수  경남은 방위산업 중심  방산부품연구원 설립 건의,Social
대전동부서  중간서 돈 가로챈   대 보이스피싱 현금수거책 검거,Social
 내일 날씨  오후부터 흐리고 중부  비  큰 일교차 주의,Social
 불 끄는 얼음  가스 하이드레이트 소화탄 개발,Social
철도노조 태업에 무궁화호 등 열차   대 최장  시간   분 지연 종합 ,Social
경찰     신고 앱으로 자동전파 늑장보고 방지 종합 ,Social
 장애인 위해 써달라  청주시에  억원 현금다발 전달한   대 ,Social
화천군  이전  이기자 부대  지휘관에 명예군민패 전달,Social
   허위사실 공표 혐의 우범기 전주시장  무혐의 ,Social
군부대 만연한 불법 도박 휴대전화 사용 이후 급증,Social
 르포  적막감 감도는 의왕기지 멈춰선 트럭에 물류대란 현실화,Social
  정부  호 대법관  오석준 후보자 임명동의안    일만에 가결,Social
안전조치 안 해 노동자 추락사 법원  건설업체 대표 법정구속,Social
 부모상 방명록 공방  정태영 현대카드 부회장  심 승소,Social
부산 광양항 화물노동자 수천명 집결 전국 물류  삐거덕   종합 보 ,Social
검찰   선거법 위반 혐의  강용석 자택 사무실 압색,Social
이주호  시도교육감과 첫 만남  고등교육특별회계 허심탄회하게 논의 ,Social
이주호  시도교육감과 첫 만남  고등교육특별회계 허심탄회하게 논의 ,Social
 선거법 정치자금법 위반 혐의  강용석 자택 등 압수수색,Social
칠곡서 로또  등  장 무더기 당첨  럭키 칠곡 포즈  영향 ,Social
  일 학교비정규직노조 총파업 광주    개교 대체급식  개교 미운영,Social
 선거브로커 연루 의혹  검찰  우범기 전주시장 불기소 처분,Social
태백 테마파크    세이프타운   강원 유니크 베뉴 공모  선정,Social
정진상 구속적부심 청구 기각 구속 유지,Social
 대법관 공백    일 만에 채워져 멈춘 재판들 속도 내나,Social
조두순 결국 선부동으로 이사 접었다 향후 거처에 관심 종합 ,Social
 기초생활수급비 줄었다  주민센터 찾아가 분신 시도   대 입건,Social
검찰   정치자금법 위반  혐의 강용석 자택 사무실 압수수색,Social
 착한리더가 세상을 바꾼다   기부엔 한도 없어   능력만큼 실천하길 ,Social
 기자가 왜 대통령 전용기 타나  헌재  헌법소원 각하,Social
 이태원 국정조사 에 대검 포함   법조계  마약 단속도 못하는데 황당 ,Social
숭실대 신임 이사장에 오정현 사랑의교회 담임목사,Social
대구 광주  공항 아시안게임  등 공통 현안 협력   일 달빛동맹 협약,Social
헌재  아동 성학대범 공무원 영구 임용제한은 헌법 불합치 ,Social
이상민 세종에이치알 대표  지역청년     여성 장애인 일자리 창출 매진할 것 ,Social
정부  이태원 참사 유족모임 마련 예정   추모 시설도 검토 ,Social
도이치모터스 김건희 공소시효    월 초 아닌  년 후,Social
 내부갈등  가세연  재판 변호도 따로 김세의 측  김용호 믿고 한 것 ,Social
 선처해주면 자랑스러운 아빠로  발언했던 국내 최대 성매매 사이트 운영자 최후,Social
 광명 세모자 살인  피의자  국민참여재판 신청,Social
대구 광주  공항 특별법  연내 제정 협력 달빛동맹 협약 종합 ,Social
   개월 딸 시신 김치통 유기  친모 자택 친정집 압수수색,Social
울산 화물연대 총파업 출정식 화학 자동차업계  주시 ,Social
