titles,category
 제재 해야 하는데 원유는 필요하고    러시아 원유가격 상한제 표류,World
 축구 양보 못해   첫 상대 우루과이 어떤 나라 ,World
 동성애 혐의 로 수감 석방 반복 안와르  우여곡절 끝 말레이 총리됐다,World
아이폰 생산기지   폭스콘 시위 거세지자  공장 떠나면 돈 지급 ,World
 번호판 갈등  코소보 세르비아     중재속에 합의 도달 종합 ,World
가시밭길 걸어온 안와르  드디어 말레이시아 총리 됐다,World
코로나 잡으려다 홍역 유행 초비상 영유아 백신 접종률 최저치 종합 ,World
스위스  러  유가 상한제  동참 무기수출은 우크라에도 금지,World
파란만장 도전 끝 총리 오른 안와르 말레이 안정 개혁 이룰까,World
   내달 금리      만 올릴 듯 캐나다 호주도 속도 늦춘다,World
파키스탄  정계 실세  육군참모총장에 무니르 중장 낙점,World
   침체 먹구름   국제유가    대로  뚝 ,World
겨울인데 우크라 전력망 초토화     러 테러지원국 지정,World
  비야디  전기차값 최대    만원 인상 테슬라와 정반대,World
 피플  포커스     년을 기다렸다  안와르 이브라힘 말레이 신임 총리,World
튀르키예  시리아 쿠르드민병대 소탕작전에 지상군 투입 예고  미 러도 못말려 ,World
 영상   푸틴  헤르손 철수 후 생명 위협 느낄 만큼 타격 패하면 종말 ,World
 한방에   억  미국서 세계 최고가 약 허가  형 혈우병 신약,World
 러시아의 구글  얀덱스   푸틴과 관계 개선 위해 최측근 영입 ,World
 고작 영화 한 편 상영이 정상회담 성과   중국 불법 시청은 그냥 두더니  핀잔만 들었다  인사이드 차이나 ,World
봉쇄 푸나   집중한   기업들 웃는다,World
러 무차별 공습에 우크라 전 지역 정전    추가 군사지원,World
유럽서도 흔들리는 화웨이 입지 조직도 축소,World
  는 우루과이 승리 예측 박지성  한 골 차 한국 승리 ,World
 일문일답     우크라 지원 감사   제 건국  복구사업 함께하자 ,World
우크라부의장  북러  모종의 협력    군사지원 가능성 배제못해 ,World
 우린 문밖에도 못나가는데   노마스크  월드컵 본 중국인 분노,World
한국  오늘 밤 우루과이와  차전 손흥민 출전할까 ,World
역전패에 분노한 호주팬  프랑스팬 향해 분풀이,World
 예상밖 선방      최악 침체  내년 세계경제 놓고  갑론을박 ,World
  긴축   코로나    에너지 위기 재부상   의 공포 ,World
    러 우크라서 화학무기 사용 우려 대비 태세 강화 ,World
   최후의 보루  뚫렸다  베이징  봉쇄 공포에 사재기 봇물,World
 푸틴  생명위협 느낄 만큼 떨고 있다  헤르손 내준 러시아는 지금,World
 투자 귀재  워런 버핏  대만      사고       팔고,World
 포착  뼈대만 남았다 러  미사일에 잿더미 된 우크라 수도,World
대만 국방부   군함  대만 동부해역서 대잠수함전 훈련 ,World
열 빛 물 끊기는 우크라  러  유럽 난민위기 유발 의도 ,World
힘 빠진 러시아  동맹도 흔들린다,World
 푸틴  헤르손 철수로 생명의 위협 느낄 만큼  불안  ,World
러  우크라 에너지 시설 또 노려 대규모 공습에 최소   명 사망,World
 르포  봉쇄령 에 긴장감 돌았던 베이징의 밤,World
봉쇄 완화 기대에   시장에 힘준   기업 주가 올랐다,World
 중국 공산당 지도부   푸젠성 연고   명으로 최다 ,World
튀르키예  쿠르드 세력    개 목표물 타격 지상군 투입할 것 ,World
공화당  삭감  엄포 속   바이든  우크라에  억 달러 추가  군사 지원 ,World
러  반전 단체 엄마들  뿔났다  푸틴  피하지 말고 대화하자  촉구,World
 일본이 독일 이긴다  카타르 월드컵    판다  예언가  화제,World
    이어  도  감속  보폭 줄이는 글로벌 긴축,World
폴란드  패트리엇 지원하는 독일에  우크라에 대신 주자  제의,World
 무지개 축구화  독일팀  입 막고  무언의 항의  이유는 ,World
   축구 해설위원  한국 우루과이 무승부  예측  누리꾼  오늘만은 한국 응원하자 ,World
크레디트스위스 위기설 돌자 슈퍼리치들  서둘러 돈 뺐다,World
애플  공장  레미제라블  시위 폭스콘  퇴사하면    만원 ,World
공항  액체류 노트북 꺼내기  점차 사라질 듯    불필요 ,World
   조롱  독일 뤼디거  원숭이 취급에 발끈한 내로남불 재조명,World
시진핑만 자국 브랜드 차량 일본 총리도    서 벤츠 탔다,World
    국가가 재산권 통제  국가화 계획시장 으로 간다 ,World
       랩터 이어 핵추진잠수함  오키나와 기항 공개,World
소련 국민차  모스크비치  부활  중국산  랑 똑같아 보인다 ,World
 피라미드  올라가 춤춘   대   머리채 잡히고 물벼락 ,World
 왕따 인싸  빈 살만  튀르키예 구세주로     억  통화스와프 논의 ,World
일본도 독일 꺾었는데 중국은    내부서 자조적 비판 목소리,World
확진자 폭발한     조여진 방역에 성난 민심 최고조,World
     정상회의 곳곳서 파열음 푸틴 입지도  흔들 ,World
 우리에게 해준 게 뭐야     푸틴  아르메니아서  굴욕 ,World
영문도 몰랐던  기내 액체 반입 금지  영국부터 사라진다,World
 르포   방역 최적화 라 쓰고  봉쇄 라 읽는  코로나 정책,World
 헤르손 내준 푸틴  전쟁 지면 종말   생명 위협 느낄만큼 두려워해 ,World
기시다  독일전 승리 일본 대표팀에  멋진 승리  열도 열광,World
 현대차   서 역대 최고 점유율     전망 ,World
  유세땐 어묵인데 대만 선거 후보들 채소 들고 찰칵  왜 ,World
코로나 규제 없애고 대박난  이곳  한국 관광객도 줄지었다,World
 같은 행성 맞냐      노마스크 월드컵 본 중국인들 뿔났다,World
애플 주가 어제는 올랐지만 정저우 공장 충격 견딜 수 있을까 ,World
    우크라 조기 패전 선호   존슨 주장 일축  완전 헛소리 ,World
 폭력사태    폭스콘  공장 떠나면    만원 지급 ,World
추수감사절 앞두고   명 사살    월마트 총기난사 용의자는 매장 매니저,World
 공급망 비상  애플   정저우 폭스콘 공장에 직원 파견,World
   방역 고삐 죄면서 경기부양 돈 풀기,World
영국 떠나 독립하려던 스코틀랜드  이번엔 대법원에 막혔다,World
 연임 시진핑  사회주의국 정상 연쇄 초청 북한은 언제 ,World
감염자 폭증에 결국 또 봉쇄 베이징서 재현된  패닉 바잉 ,World
 폭스콘  시위 벌인 신규 노동자에  즉시 떠나면    만원 줄게 ,World
 냉전 덕분    밀착 강화하는   유럽 경제,World
 푸틴 심각한 타격 생명 위협 느낄정도  러시아에 무슨일이 ,World
신규 감염자 역대 최다 중국  올봄  팬데믹 과 다른 점은,World
 자막뉴스  무차별 러시아 공습에 파괴되는 우크라이나  상상초월 ,World
미  우크라에 방공 무기 등  억달러어치 추가 제공,World
 봉쇄 그만  임금 내놔   대규모 시위에   폭스콘  퇴사시    만원  제안,World
정저우공장 시위 얼마나 심각하길래 애플도 직원 파견 종합 ,World
  코로나 감염자  년만에 최고 방역 고삐 풀렸나,World
푸틴  징집 가족 면담 거부 확산  계획된 자리 안 간다 ,World
    러시아  테러지원국   겨울 노린 공습 계속,World
 본선은 못 올랐지만     월드컵 실리 챙기기,World
   나발니에 썼던 노비촉처럼 러  화학무기 우려 ,World
위기의  기시다   백지 영수증  문제 인정    내년 초 국회 해산  소문도,World
우크라 전황  겨울에 바뀌나 러  우크라 인프라 시설 집중 타격,World
러시아 개그맨 장난전화에 폴란드 대통령   분  초  회담,World
  하루 코로나 감염자 수  만 명 돌파  역대 최대,World
우크라  푸틴  헤르손 철수 후 두려워하고 있다 ,World
글로벌 경기 엇갈린 전망  급격한 침체 없다      역대 위기보다 심각 ,World
투자의 귀재 버핏이   년째 보유하고 있는 주식은     ,World
독일   우크라의 신속패전  원했다는 존슨 주장  말도 안돼 ,World
독일에 역전승한 일본 열도  들썩     도하의 비극이  기적  됐다  ,World
중국 확진자 다시 최고    무차별 방역  회귀,World
교황  우크라전은 홀로도모르   러시아  아랑곳없이 미사일 공습,World
 코로나 노숙자  양산하는 중국 광저우선 다리 밑  지하도에 살림 차려,World
 사우디  터키 중앙은행에   억 달러 예치 협상 중    ,World
 미국 반도체업체 엔비디아  홍콩 물류센터 대만으로 이전 ,World
 년 만에 전세계 떠들썩한데 나홀로 우울한 중국,World
     세계경제  우려만큼 심각한 침체 겪지 않을 것 ,World
 와이파일  사우디 일본의 대이변 속 호주의 대패   벤투의 선택은 ,World
  극단적 코로나 봉쇄   경제 돌발변수로,World
   월엔 빅스텝     연준 금리  감속 ,World
 년뒤 영국 공항부터  액체류 제한 노트북 꺼내기  사라질듯,World
러  하루에 미사일   발 퍼부어 우크라 전역이  암흑 ,World
 러시아에 이익 안돼      러시아산 원유 상한제 합의 실패,World
  년 전  도하의 비극 이  기적 으로 일본  역사적 승리  열광,World
   코로나   회복 불능 시점 도달 제로코로나 완화 어려워 ,World
  코로나   신규     명 총   만    명    명 추가 사망,World
유엔 안보리   러 에너지 테러  규탄  푸틴  겨울 무기화  종합 ,World
테슬라  월가 투자의견 상향에    가까이 반등,World
러 주도 군사협력체 분열음 아르메니아  푸틴 면전서 불만 표출,World
바이든  추수감사절 연휴 가족과 함께  대선 재출마 논의할 듯 ,World
 줌인   바이든의    는 중국식 전략     맞불 입법  경고한    ,World
   러시아 원유 제재하며 베네수엘라 원유 제재는 푼다,World
방공망 강화 나선 나토  루마니아서 모의 훈련 진행,World
 본선은 못 올랐지만     월드컵 실리 챙기기,World
러    발 미사일 공습에 우크라 전 지역 정전 피해,World
 지구촌 돋보기   한국 반도체  잡겠다며 토요타 소니 뭉쳤다 파급력은 ,World
러 주도 군사협력체 분열음 아르메니아  푸틴 면전서 불만 표출,World
  광저우 코로나에 후베이성 출신 농민공들 노숙자 신세 전락,World
 전문가  북한  정상각도로      발사해도 놀랄 일 아니다 ,World
   도발     불안 조성 목적     약속 못 믿게 위협 ,World
가스프롬    일 오전  시부터 우크라 경유 가스관 공급량 축소 ,World
  폭스콘 근로자 수백명  공안과 충돌   아이폰 공급 차질 불가피,World
 영상    코로나 재봉쇄 경제 행사 줄줄이 연기 노동자는 분노  나우 어스 ,World
  년전 호수에 풀어준 금붕어       초대형 으로 자랐다,World
   겨울전쟁  앞둔 우크라 전폭지원 누적 군사지원만   조원대,World
  연준   경기 침체  첫 언급,World
일본 총리도    서 벤츠 탔다 한일 정상의  불편한  평행이론,World
중국 결국 지준율 인하 이르면 이번주 단행,World
코로나   잡기에 집중했더니  홍역  전 세계 유행 가능성에  비상 ,World
미 연준  금리 인상 속도 좀 늦추자      월  빅스텝  예고,World
젤렌스키 측근  푸틴  헤르손 철수 후 생명 위협 느낄 만큼 불안 ,World
 전차군단  독일 무너뜨린 일본 역사적 승리에 들썩이는 열도,World
러  우크라 기반 시설 또 공습    산부인과 병원까지 공격,World
  전술핵 재배치시 한국 쪽에서 한반도 긴장 고조시킬 것  언론,World
엔화    금리인상 둔화 관측에  달러    엔대 전반 상승 출발,World
    러시아  테러지원국   겨울 노린 공습 계속,World
젤렌스키 측근  푸틴  헤르손 철수 후 생명 위협 느낄 만큼 불안 ,World
     세계 경제  예상보단 덜 나쁠 수도 ,World
  연준 속도조절 시사하자 주담대 금리 하락세,World
     러  원유가 상한액 합의 일단 실패   일 논의 계속 ,World
젤렌스키 측근  푸틴  헤르손 철수 후 생명위협 느낄만큼 불안 ,World
러  미사일 발악 한 날      우크라에  억달러 추가 군사 지원,World
김여정    실명 거론하며 맹비난     때완 다르다 ,World
  시진핑  연임 확정과 동시에  시진핑 퇴진  구호가 나왔다,World
  폭스콘 공장 직원들 집단 탈출 공안과 충돌로 아수라장,World
러시아  우크라에 또 미사일 공습   몰도바도 다시 정전,World
  년 만에 가장  잔혹한 겨울    추위와 공포 덮친 우크라이나,World
러시아  르노가 철수한 공장에서 구소련  모스코비치    생산,World
러시아 미사일 맹폭에 우크라  블랙아웃   원전 폐쇄  몰도바도 정전,World
코로나 잡으려다 홍역 유행 초비상 영유아 백신 접종률 최저치,World
 매체  네덜란드   주도 대중 압박에 반기   목소리 내는 것보고 배워 ,World
 서역길  만 천   중 유럽 열차  한해 컨테이너    만개 나른다,World
일본     승리 맞힌  문어  전문가 한국  우루과이 예측은,World
코로나 잡으려다 홍역 유행 초비상 영유아 백신 접종률 최저치,World
직원 탈주 이어 대규모 시위    폭스콘     만원 줄테니 떠나라 ,World
튀르키예  쿠르드 무장세력 목표물 공습  지상군 투입해 소탕작전 ,World
짐바브웨  중국돈으로 지은     억짜리 국회의사당 문 열어,World
   러시아  원유 가격 상한액 합의 불발 입장 차 커,World
러 대대적 공습에    우크라 무기 긴급 지원,World
미 연준    월      의사록서  금리인상 속도 곧 느려질 것 ,World
 자막뉴스  살벌한  암살 무기  우크라 출격 대기    러시아 막아야 ,World
빅터 차       에   확장억제 약속  의심 심으려 해 ,World
다음 대회서    억원 공제 요구  계산기 두드리는 버드와이저,World
      현대차그룹  올해   시장서  최고의 한해  예약 ,World
러  우크라에 또 무차별 공습  수도 전력 공급 중단 ,World
     세계 경제  예상보단 덜 나쁠 것 내년 바닥 찍을 수도 ,World
얼마나 시위가 심했으면 폭스콘     만원 줄게 회사 나가라 ,World
연준  금리인상 속도 곧 느려질 것  내년 경기침체 가능성 제기,World
       의사록서  금리인상 속도조절  나스닥    ,World
     의사록  조만간 금리인상 속도 늦추는 것이 적절  종합 ,World
미  러 미사일 막는 대공포 등  억 달러 지원  러  난민 무기화 ,World
미 연준  기준금리 인상속도의 둔화  곧 적절해질 것 ,World
 기막힌 우연    사우디 감독 여친       세네갈 감독 부인이였네,World
올라가지 말랬는데   세계 유산  피라미드서 춤 춘 관광객의 최후,World
    제한구역서  무인기 수백 대 탐지  악용 우려 ,World
  연준  금리 인상 속도 늦춰야    경기침체 가능성 언급,World
러 대대적 공습 속    첨단 요격미사일 등 우크라 추가 지원,World
 한 지붕 두 대통령  베네수엘라   년여만에 협상 재개,World
 영하   도  겨울전쟁서 반전 노리는 러 우크라 전기 집중 타격,World
러시아군 미사일   발 공습   명 사망  곳곳 정전,World
  년전 호수에 풀어놨는데     초대형 금붕어로 자랐다,World
 전차군단  독일 이긴 일본  한국에 행운의  한 마디 ,World
   우크라에 드론용 대공포 등  억 달러 규모 추가 군사지원 종합 ,World
뉴욕증시        속도 조절  언급에 상승 마감 테슬라    가까이 급등,World
    러시아  테러지원국   겨울 노린 공습 계속,World
