titles,category
일산 분당 등  기신도시 재건축 추진동력  시들 ,Economic
부동산   기근에도 롯데건설 사업장  곳 리파이낸싱 성공,Economic
 아는 기자 금리 인상 속도 조절 앞으로 얼마나 더 인상하나 ,Economic
파업때마다 꺼내든  운송개시명령  카드  이번엔 발동하나,Economic
멈춰선 유조차들 주유소는 기름 못 팔까 비상,Economic
 코인뉴스  파산한     창업자 사과  돌아갈 수 있다면 뭐라도 하고 싶어 ,Economic
카셰어링 규제 줄여 편도요금 낮춘다 마트 새벽배송은 보류 종합 ,Economic
 깎아주고 얹어주고  월드컵 특수에  년 만에 설레는 유통가,Economic
강원 아파트 가격  하락세  거래  한산 ,Economic
 시간 추가근로제 일몰  중기  생산성  납기지연 불가피 ,Economic
 구광모의      임원      명 됐다   첫 여성      명 누구 ,Economic
침체기 메리트 있나 직접투자 쏠리며 무너지는 펀드시장,Economic
    위기 뚫고 새 미래 짠다    차석용 매직  막 내리고 첫 여성     탄생,Economic
 이젠 낙하산 벗어날 때   지역 잘 아는 인물 절실,Economic
저가 매력에 실적까지 진격의 효성그룹 ,Economic
 변화와 혁신 의 길 달려 온 구광모     안정 속 미래 설계 ,Economic
 기획   개월전  정부 미봉책 이 파업불렀다,Economic
 경기 꺼지고 돈줄 마를라  한은  베이비스텝  속도조절 ,Economic
 블랙프라이데이가 온다  할인에 쿠폰 적립금 더 챙기려면 ,Economic
올해 마지막 금리인상    베이비스텝  유력,Economic
올해 마지막 금리인상    베이비스텝  유력,Economic
  일 연속 상승    금리   기준금리 인상에 더 오를까,Economic
             달리오  소비재 기업 빼곤 주식 팔아  드러켄밀러   분기 들어선 매수 전환,Economic
        내년 경제성장률        한은  경제한파 예고,Economic
 카카오그룹   단기반등에 그칠 것       년 증시전망 ,Economic
한달 넘게 이어지는 파리바게뜨 불매 속 타는 점주들,Economic
충격 감안한  베이비 스텝   그래도 사상 첫  회 연속  점프 ,Economic
전세가율 한달새 또 올라   대전 깡통전세  위험  세종은 역전세  비상 ,Economic
화물연대 총파업 돌입 정부  업무개시명령 발동  예고,Economic
  개월 새        껑충  가계 이자 부담   조 늘어,Economic
 반도체 밀고  차전지 끌고  성장주도  기지개 ,Economic
연준   경기침체  가능성 주목 산타랠리 기대 부푼 월가          ,Economic
  긴축완화   금리인상에 환율   원   증시프리즘 ,Economic
대출금리   대 코앞 가계 이자부담   개월새   조    기준금리 첫  연속 인상 ,Economic
법원          에    억 돌려줘야  배상액 절반 이하로,Economic
 정면승부   한은  목표 수준 기준금리 도달했나  한숨 돌려도 되겠다 싶으면 착각 ,Economic
화물연대 전국 곳곳서 파업 컨테이너 반출입량     급감 종합 ,Economic
 기준금리 연      로 인상  주담대 연    신용대출    현실화  취약계층    벼랑끝,Economic
분양 포기해야하나  계약금보다 더 떨어진 하락폭,Economic
   억 횡령 징계나선 금감원  손태승 우리금융회장 연임 걸림돌,Economic
 상장사 리포트  양극재 투자  뚝심  빛 본   화학  하락장에서도 상승세,Economic
 포스코가 멈추면 국가 경제도 멈춘다는 생각에 복구 올인 ,Economic
연준 속도조절  한국 베이비스텝에 원화가치   원 급등,Economic
젊은피 대거 채운     권봉석 권영수는 유임,Economic
   생건 차석용 매직    년 만에 막 내려   이정애 새 사장    그룹 첫 여성    에,Economic
둔촌주공 레미콘 공급 중단  현대제철     톤 물량 묶여,Economic
수출  발묶이고 철강제품 출하 중단  산업계 도미노 피해  화물연대 총파업 ,Economic
내년 경기 침체라는 연준  시장은  곧 반등  엇갈린 전망,Economic
한국은행  빅 스텝 아닌 베이비 스텝  왜   기준금리 첫  연속 인상 ,Economic
아파트값  주째 낙폭 신기록  추가 하락 불가피 ,Economic
 단독     뉴 삼성   반도체 전담  글로벌 리서치  신설,Economic
코인 충격에도 코인투자 늘린 이곳  주가     급등 왜,Economic
  일간    조가 빠져나갔다  크레디스위스에  리먼 이 어른거린다,Economic
 치킨 전쟁   심      배상액 절반으로 결국 대법원까지,Economic
복구 기적 일구는 포항제철소  토사로 뒤덮였던 고로  쇳물 분당   씩 콸콸,Economic
  억 아파트가  억에   년 새 절반  뚝  속출,Economic
 리스크 줄여라      디스플레이 이노텍  현행 유지 ,Economic
조달비용 올랐다고 소비자에 전가  무이자할부 혜택  뚝 ,Economic
  그룹 첫 여성     발탁 차석용    년 매직  마침표,Economic
 중국 의존도 이 정도 일 줄은   발등의 불  떨어진  배터리,Economic
수출 투자 소비  트리플 악재     한은  내년 성장률     로 끌어내렸다,Economic
 매수자들 더 떨어질 때 기다려   집값 낙폭 더 커졌다,Economic
신한금융 부회장직 신설 움직임   회장 승계  투명성 확보,Economic
 주담대     초읽기  영끌 빚투족 곡소리 어쩌나,Economic
    원     원     원  회장님 만 벌고 개미는  피눈물 ,Economic
세금보다 무서운 금리  집값 하락세 가팔라질 듯,Economic
   공장 서 만든  매물폭탄   년간   조 넘었다,Economic
 쿠팡이츠 월드컵 퇴장   우루과이전 맞춰  라이더  보이콧,Economic
이창용  경기 둔화  금통위  명 중  명  금리 종점            ,Economic
원희룡  화물연대  경제 볼모로 이기적 행동 위기 초래땐 업무개시명령 발동 ,Economic
예약 전화통 불났다  한끼 인당   만원  호텔 뷔페 뭐길래,Economic
         정기 임원인사 키워드는  미래 설계   종합 ,Economic
서울 아파트값       하락 또 역대 최대폭,Economic
내년      성장에도 물가 덜 꺾여 이창용  내년 금리 인하 기대 낮췄다,Economic
확 젊어진    신사업 이끌 인재 대거 발탁,Economic
가계 이자부담  조 천억   영끌족  월 상환액    만원 이상,Economic
 거래멸종에 폐업 생각만  중개업소 눈물 강남도 매매     건,Economic
 대출이자  년새 두배  급매 내놔도 안 팔린다  영끌족 비명,Economic
경제계  화물연대 총파업 중단해야 안전운임제 한국뿐  종합 ,Economic
금리 마지노선      유지했지만  영끌족  이자 고통 은 여전  속도조절 나선 한은 ,Economic
   구광모호  안정속 혁신  택했다     유임 젊은 인재 발탁 종합 ,Economic
  그룹 인사 단행   생활건강         대표이사 교체,Economic
사상 첫  연속 금리 인상  내년 성장률     로 하향,Economic
자금시장 경색 불똥 중소형 증권사 구조조정  칼바람 ,Economic
  그룹  여성     명 등 인사 단행   미래 경쟁력 확보 포석,Economic
  차전지 로 성공적 변신      뛴 포스코홀딩스,Economic
         치킨전쟁   심         억 돌려받는다 ,Economic
   임원인사  투 트랙 전략  사장단은 유임  허리는 세대교체,Economic
 단독  국세청  독점 논란  카카오 계열사 세무조사,Economic
유로화 오르자 유로존     날개 달았다,Economic
철강 출하 막히고 석유화학 생산감축 검토  피해액 최소  조 ,Economic
양극재 원료   에      의존     앞둔  배터리의  약한 고리 ,Economic
 마켓인  금리 따라잡기  급여율 올리기 벅찬 공제회,Economic
고속도로 옆 폭    미터의 날씬한 그 집 자투리땅의 대변신 협소주택  부동산    ,Economic
 해설      차석용    생건 부회장 용퇴    인 부회장 체제,Economic
미국 금리 인상  속도 조절  재확인에도    긴장을 늦출 수 없는 이유,Economic
 르포  포스코 침수  기적의 복구   연내   개 공장 가동 ,Economic
  개월새 가계이자   조 급증  이창용  국민 고통 알고있다 ,Economic
 부동산 활황때 돈 번 금융권 자금경색 스스로 해결해야 ,Economic
    내년초    고물가  성장률은   대    가 다가온다,Economic
 화물연대 파업 철회하고 안전운임제 없애라 ,Economic
 안전운임제 영구화  내건 총파업에 정부  업무개시 명령 발동할 것 ,Economic
 뉴스속 인물   생건 첫 여성 사장 이정애  화장품 고급화 이끈 주역,Economic
오건영  제 의 금융위기  극단적 비관론 벗어나야            ,Economic
목동 단지 신통기획 용역 착수  정밀안전진단 통과 이어 재건축사업 속도,Economic
    안정 속 혁신에 방점   신규임원        년 이후 출생,Economic
서초 삼풍 우성 차 재건축 수월해진다,Economic
 대통령  적극 지원 에 화색 도는   방산 연타석 홈런 칠까,Economic
서울 전세가격       떨어져 역대 최대,Economic
인근 집값 수억원 떨어지자  계약 취소  돌변한 당첨자들,Economic
칼바람 부는 여의도 증권가,Economic
 집값 더 떨어지는 데 누가 청약하나   블루칩 단지마저  참패 ,Economic
 중도금 대출 가능    둔촌주공 재건축  청약전쟁 예고,Economic
     빈 살만 사우디 왕세자  카카오에  천억 원 투자 검토 최종목표는   엔터 ,Economic
금리인상 속도 조절,Economic
 월급은 다 이자로  뭐 먹고 사나  대출금리 또 뛴다,Economic
 생생경제     조 투입한 카타르 월드컵  경제적 효과 금액은 어느 정도 ,Economic
    파산에  고팍스     억 지급연기 국내 투자자  불똥 ,Economic
내년 물가 전망           이창용  스태그 지적은 과도 ,Economic
   년만의 고로 가동중단 결정이 포스코 심장 지켰다 ,Economic
  생건 영업익   배 키운     귀재    년 매직  마침표 찍다,Economic
환율 떨어지자 경기 챙긴 이창용 내년  분기까지 한번만 올린다,Economic
해약 급증에 보험사    대 저축상품 눈앞,Economic
박현철 대표이사 내정자  롯데건설  구원투수  될까,Economic
  리포트  기준금리         인상  사상 첫  회 연속,Economic
서울 서초 이수아파트지구  재건축 수월해진다,Economic
연말에도  출렁 증시  경기방어  담을 때,Economic
 중국 인구 앞지를 것    대 경제대국 으로 떠오른 나라,Economic
같은 최종금리     라도   조건  달라졌다,Economic
내년 성장률      경기 둔화 우려에 한은  일단 베이비스텝,Economic
 미래를 그리다     구광모   핵심사업 위주 승진인사 단행 종합 ,Economic
조주완 류재철 사장    전자  가전명가  이끈다,Economic
 대 그룹서 첫 여성 사장급     나왔다  공채 출신 이정애   생건 사장,Economic
법원          에    억 반환해야  배상액 대폭 줄어,Economic
   구광모호  안정속 혁신  택했다     유임 젊은 인재 발탁,Economic
테슬라 멀미 나네 신저가 찍은 다음날    급등,Economic
고려아연 지분경쟁 끝나나   주가    급락,Economic
 자본 확충  매듭 푸는 흥국생명  예상 조달 시나리오는 ,Economic
 대그룹 최초 여성    배출한      안정 속에 미래 준비 ,Economic
  금융 소상공인 금리가       비현실적 정책금융 금리,Economic
 년 개월새        뛴 기준금리 이자부담도  껑충    인당    만원  ,Economic
    정기 임원인사 단행   년 이후 출생자     여성     명,Economic
구광모  미래 준비에 실행력 높여야       미래 설계  인사,Economic
한은  자금시장 우려 긴축속도 완화  의지에 국채 금리       원 달러 환율     원  뚝 ,Economic
멈추지 않는 디젤 가격 고공 행진  디젤  인플레 우려까지,Economic
 자금 비상  카드사  은행대출 크게 늘렸다,Economic
 종합  미래준비 담금질   그룹 구광모  혁신 택했다,Economic
  그룹   미래 설계  임원 인사 신규 임원      젊은 피 ,Economic
 세종 에버파크   세종시 우선 접수 마감   내일부터 일반 접수 시작,Economic
은마아파트       갈등 고조에 원희룡  사법조치 불사  강경,Economic
신규임원    가   년 이후 출생         년 임원인사 단행,Economic
철강 출고 멈추고  시멘트는 해상 철도로 화물연대 파업에 피해 확산,Economic
채권금리  금통위 이후 급락 코스피    가까이 상승 마감 종합 ,Economic
조두순 결국 선부동 이사 포기 보증금     만원 돌려받았다,Economic
서초 이수 아파트지구 재건축 사업 쉬워진다,Economic
한국은행도    처럼  한국형 점도표  공개한 이창용  조미현의     워치 ,Economic
  억 한채 종부세    만원인데   합산   억 두채는     만원,Economic
 서민의 발  포터 꾸준한 사랑  의외의 비결은 ,Economic
 연일 신저가  테슬라  돌연 급등한 이유   분 미국주식 ,Economic
비트코인 횡보    만    달러까지 하락   코인브리핑 ,Economic
 내년 구조조정 기업 쏟아질 것   지금은 현금 비축할 때 ,Economic
 금리 종착역은      정도라는데  기준금리는 한참 더 간다 ,Economic
물가 때문에 금리인상     금리 올려도 물가 잡는데  년 걸려 ,Economic
  방산      년까지 세계 점유율    목표 민관군 힘 모은다,Economic
금리는 계속 오르는데   서민 외면 받는 정책금융 상품,Economic
곡물값 뛰니 새 농기계 찾는다   세계  위  디어  호실적,Economic
 폭      냉천이 덮친 포항제철소    일만에 복구기적 만들다,Economic
 월가월부  코인 손실에도 펀드자금 몰려   블랙록  한달새     급등,Economic
 시그널  올 마지막 회사채            억 발행,Economic
 공장 세워야 할 수도  화물연대 파업에 철강 화학 등 촉각,Economic
한은  속도 조절 나서나   이창용  우리 정책에는 국내요인 먼저 ,Economic
우리금융 이사회  중징계 등 라임제재 대응 논의 나섰다,Economic
재계  단체  줄파업 멈추고 노란봉투법 중단해야  민주노총 정면반박,Economic
대출금리    넘기나   또 오른 기준금리에 차주  긴장 ,Economic
최종 금리 전망치     로 하락  비둘기  이창용에 원화자산 트리플 강세,Economic
 치킨대전   심  개 소송     승         억 돌려받아  상고할 것 ,Economic
증권가에 부는 칼바람    다올투자증권 희망퇴직 실시,Economic
 한달 원리금만   만원 늘었다   월급의 절반이 대출 원리금 ,Economic
     가상화폐 위기  금융시장 전체로 번지진 않을 듯 ,Economic
안갯속 리셀 시장 수백억 적자에도 줄줄이 노크,Economic
한은  경기 둔화 예상보다 커질 것  통화정책 기조 바뀌나,Economic
 영끌했더니 쓸 돈이 없어요    고금리에 내년 경기  꽁꽁 ,Economic
      법인세는 내리고 소득세  부가가치세는 올려라    세부담 가계 전가 논란,Economic
금통위   베이비 스텝  단행 금융시장 안정화가 목표 ,Economic
한은  기준금리        인상 증시 대출금리에 미칠 영향은 ,Economic
내년 한국 경제   대 성장 그칠 듯  경기 한파  오나,Economic
이복현 금감원장  자금조달 우려에  은행  타은행채 인수 방안 검토 ,Economic
수험생 점수 올리고 노인 치매 예방해주는  참기름   리그난 성분 강화된 참깨 신품종 나와,Economic
법원          에 손해배상액    억 원 돌려줘야 ,Economic
 가이드도  강제성도 없으니 하던대로  혼란뿐인 일회용품 제한,Economic
 연속 금리인상해       자금경색 우려에  베이비스텝  종합 보 ,Economic
기준금리 또 올려       사상 첫  회 연속 인상,Economic
이복현  은행간 은행채 인수 등 유동성 확보 방안 검토 중 ,Economic
경제  단체  한국만 하는 안전운임제 실효성 없어 폐지해야 ,Economic
일회용품 제한 정책에 제지   지속 가능성은,Economic
 치맥 미리 준비하세요  광화문광장 음식배달 안된다,Economic
현대제철 노조   일 만에 게릴라 파업 유보 교섭 시작,Economic
화물연대  무기한 총파업 돌입 이 시각 현장,Economic
  내보험 찾아줌 에서 숨은 보험금 찾아가세요 ,Economic
화물연대 파업 첫날 물류대란 현실화 장기화 우려도,Economic
카셰어링 영업구역 제한 풀린다    공유  활성화 기대,Economic
이복현  우리  횡령 제재  국민이 납득할 수 있어야 ,Economic
화물연대  성수기 파업   오비맥주 일부 출고 차질,Economic
 일문일답 한은 조사국장  금리        인상  성장률            하락 효과 ,Economic
비둘기 금통위에 환호한 외환 채권 시장 종합 ,Economic
 화물연대 총파업  국민 동의안해  원희룡  첫날부터  작심비판 ,Economic
 운명의 날  다가온 포지오티닙      확률 뚫을까,Economic
 현장   계도기간이니까  일부 카페서 플라스틱빨대 사용 여전,Economic
 한국판 점도표  첫 공개한 이창용  넥타이 메시지   도 화제,Economic
빅스텝 대신 베이비스텝  연말 증시 산타 랠리 가능할까,Economic
  전자 임원인사  미래 고객에 방점 류재철 사장 승진,Economic
경제 단체  화물연대 일방적 운송거부 철회하라 ,Economic
  그룹   대그룹 최초 여성      명은 누구 ,Economic
포니 디자인한 주지아로  포니 쿠페 복원에 팔 걷어부쳤다,Economic
포스코 현대제철  화물연대 파업 첫날  만 천   출하 차질  예상,Economic
글로벌  위 코인 거래소 파산  한국  대 거래소 자금도 묶였다,Economic
여의도 증권가 구조조정 칼바람  연말 재계약 두렵다 ,Economic
         손배소 항소심서    억원 돌려받는다,Economic
 르포   종이봉투    원입니다   일회용품 규제 첫날 편의점에선,Economic
이복현 금감원장  은행 간 은행채 융통하는 방안 검토 ,Economic
 르포   종이봉투    원입니다   일회용품 규제 첫날 편의점에선,Economic
이복현 금감원장  은행 간 은행채 융통하는 방안 검토 ,Economic
  온   시그넷   충전기 로 배터리 진단 서비스 만든다,Economic
   년 연속 성장 신화  쓴   생건 차석용 부회장 용퇴,Economic
구찌 전성기 이끈 미켈레 떠난다  관점의 차이 때문에 길 갈라질 때 있어 ,Economic
철강주 리튬주로 변신한 포스코홀딩스 주가       내년 기업가치 부각 본격화 ,Economic
강서 행복주택 전면 재검토 내년 착공 사실상 물 건너가,Economic
  번지이슈  화물연대 총파업 전국 물류거점 곳곳 운송차질,Economic
국토위서  이재명표  공공임대 예산 증액 의결 야당 단독 처리,Economic
         항소심 일부승소,Economic
        와 항소심서 승소했지만 가지급 손배액    억 반환       사실상 승소 ,Economic
화물연대 총파업 전국서 동시 출정식 첫날     명 참여,Economic
 자막뉴스  교통체증은 이제 안녕    차보다 빠른  하늘을 나는 택시 ,Economic
 법률  아이콘   가족에게 명의신탁한 부동산 되찾으려면 ,Economic
박세익 체슬라투자자문 대표  외환위기  안 온다 허 찌르는 강세장 기대            ,Economic
 부동산 바닥 신호가 기회  김인만   주택은 보험            ,Economic
  경제성장률   대  수렁     위기 계속된다,Economic
한은  내년 성장률      경상수지 흑자규모도 대폭 하향 종합 ,Economic
태풍 심하면 등교 금지,Economic
한 억만장자의 경고  과거 위기보다 심각 기술주  장기침체 대비해야 ,Economic
우영우 다음은  재벌집 송중기           상한가 친 래몽래인,Economic
법원          에 배상해야        심 청구금액 대부분 기각 ,Economic
위중증 엿새째    명대  젊은층도 백신 맞아야 ,Economic
삼성생명 즉시연금  심 승소에  보험업계는  안도   소비자는  분통 ,Economic
후분양  장점보다 단점이 많다는 옛 말 직접 확인하고 빠르게 입주 가능한 단지 눈길,Economic
결혼 이별 독립   회사도 인간처럼 관계를 맺는다  조은나라 세무사의 너와 나의 회계고리 ,Economic
 매수 매도  동시에 클릭하니   하락장서도 든든  허서윤 기자의 틴재테크 첫걸음 ,Economic
세금 폭탄 우려에 공시가  년 전 수준으로 환원,Economic
    년 세계 대 방산 수출국 도약    기계 항공 등에     억 ,Economic
 한 지붕 두 가족  고려아연  장 최  지분율   대로 좁혀져,Economic
 여기까지 물 찼다       빨간 화살표    고추건조기까지 동원한 포철 모습은 현장 ,Economic
우승국에 돈 몰아주는 월드컵  축구팬들 위한 겁니다  최병일 박사의 말랑말랑 경제학 ,Economic
 라이더 파업한다더니  쿠팡이츠  배달 대란 없었다,Economic
금리 인상에 증권사 신용융자 금리도     돌파,Economic
 그날   그 폭탄  아니라고   잘못 알려진 한국사  조인 강사의 한국사 엿보기 ,Economic
입안 자꾸 부르튼다면   면역력 떨어졌단 신호  청소년 치아 관리 ,Economic
부상투혼 손흥민 철벽수비 김민재   벤투호   강 간다,Economic
 현장   저 편의점선 주던데요  비닐봉투 사용금지 첫날 혼선,Economic
 내년  성장률         한은  사상 첫    이하 성장 전망,Economic
 년새 기준금리        인상  대출이자 두배 늘었다,Economic
                    정치권 후원 논란  몰락한 워싱턴의 큰손들,Economic
고파이  결국 출금지연 사태 발생  코인런 은 일어나지 않을 듯,Economic
 사 전직 법무팀장의 고백  감시하지 않은 죄도 무겁다 ,Economic
 차석용 매직    년 만에 마침표   생활건강 신임 대표에 이정애,Economic
기준금리 인상 속도 조절   경기 침체  초읽기 ,Economic
하루   만톤 시멘트 출하중단 화물연대 총파업 볼모로 잡혀,Economic
원 달러   원 내린     원 마감    금리인상 속도조절 영향 ,Economic
석유화학 철강업체 밀집 광양 여수 곳곳 운송 차질,Economic
 잠자는 실기주과실대금    억원 찾아가세요 ,Economic
화물연대 총파업 출정식 대구 경제계도  긴장 ,Economic
   년만의 첫 고로 가동 중단  포스코의 심장 지켰다 ,Economic
현대제철 노조  게릴라 파업 중단하고 교섭 시작할 듯,Economic
  호 기록  연거푸 경신  대그룹 첫   전문경영인 사장 탄생  종합 ,Economic
신월곡 구역 조합원   도정법 위반 업무상 배임  혐의로 조합장 고소,Economic
 비만치료제  제약시장 최대 먹거리    년 후   배 성장 예상,Economic
신제품 늘고 직판으로 바꾸고 내년 더 강해지는 셀트리온헬스케어,Economic
  녹십자  독감백신   개국에 수출   국내 치료제 시장도 선도,Economic
종근당  차세대 신약후보 유럽 임상 상 준비   바이오신약도 도전,Economic
삼성바이오로직스  거침없는 속도로       위   삼바  초격차로 더 벌린다,Economic
 조원 이상 투입해     년 세계 방산 점유율    달성한다,Economic
삼성바이오로직스  거침없는 속도로       위   삼바  초격차로 더 벌린다,Economic
 조원 이상 투입해     년 세계 방산 점유율    달성한다,Economic
    로 중국 배제 북미 배터리 생산       배터리가 맡는다 ,Economic
기준금리 인상 종착지는   내년          서 고점 찍을 듯 ,Economic
서울 아파트 전셋값   년만 최대 하락       ,Economic
현대제철 노조  게릴라 파업 중단   협상 테이블 마련됐다,Economic
서울 전국 아파트값 또 역대 최대 하락   서울       내려,Economic
 바이오  연매출  조 시대 글로벌 시장 공략 속도낸다,Economic
원 달러 환율      원 내린       원 마감,Economic
또 오른 금리 전세 내놓은 집주인은 울상  월세 몸값은 껑충  부동산    ,Economic
  전자  임원인사 단행 류재철    사업본부장 사장 승진,Economic
비상걸린 시멘트 레미콘 건설현장   오늘은 버티지만 당장 내일이 걱정 ,Economic
 르포  연내 공장   곳 중   곳 재가동 앞둔 포항제철소 빠른 복구에  기적 ,Economic
환율    원 가량 급락해     원대 하락  달러  위안 외환마감 ,Economic
서울 사당동 아파트  억    만원  경매 공매 물건 ,Economic
금리인상에 증권사 신용융자 금리도     돌파  빚투  비상,Economic
반도체 한파 내년  분기가 바닥   관련  지금 담아야   머니 주요산업 증시기상도 ,Economic
 머니 매니저의    종목,Economic
 치킨전쟁   심         억 돌려받는다,Economic
 코로나 수렁  끝이 보인다  기지개 켜는 명동 상권,Economic
희비 엇갈리는  엔터  강     톱아티스트 의존증 버려야 ,Economic
썰렁해진    시장   바이오노트가 힘쓸까  위클리 마켓 ,Economic
핫이슈로 떠오른 메리츠금융 롯데케미칼 유상증자도 촉각  빅데이터로 본 재테크 ,Economic
 한은 금리인상  내년 초 끝난다  최종금리           유력,Economic
   년 기술력과 사명감으로 구슬땀    포항제철소 복구 기적 일군다 르포 ,Economic
