titles,category
 무책임한 정부 여당 더는 못참아  호남 물류대란 초읽기     명 총파업 돌입 화물연대 파업 ,Social
이 정도였어  김동연 지사가 신설한 경제부지사  혈세 매년  억 투입,Social
 코로나  년    대 우울감 급증  만성질환 비율도 증가,Social
학교비정규직 내일 총파업 울산 초중고   곳 급식 차질,Social
경찰     신고  앱 으로도 상황 전파 보고 지연 누락 방지,Social
서울 호선 청라연장경인고속도로 지하화  증액  인천 교통 현안 해결,Social
 일단은 드릴게요  비닐봉지 금지 첫날   년 계도 에 곳곳 혼선,Social
대법  미성년 자녀 둔 성전환자 혼인 관계 아니면 성별 정정 허용 ,Social
     프레스룸          손흥민 출전 가능    화물연대 총파업    청담동 술자리 거짓말 ,Social
 월드컵 단체응원  전국   곳서  만여 명 집결 예상,Social
노동장관  화물연대 집단운송거부 우려 커 피해 최소화 총력 ,Social
  개월 딸 시신  김치통  방치 친모 친정집 압색 사전영장 신청 예정,Social
한동훈  김의겸  사과할 필요 없어 법적 책임 져야 ,Social
검찰 계좌 추적 착수  이재명  현금 종이가방 관련  대장동 일당 돈 아냐  재산 신고했다 ,Social
 물류 멈춰 세상을 바꾸자   화물연대  전국서 총파업 돌입,Social
헌재  아동 성학대 전과자 공무원 직업군인 영구 임용 제한은 부당 ,Social
기상청 퇴직공무원  직원 자녀 장학금  억원 기부,Social
행안부  이태원 추모시설 검토 유족 원하면 명단공개 가능 ,Social
 프로필  김광진   디스플레이 전무,Social
검찰   서해 피격  대북안보라인 최고위직 서훈 전 실장 조사,Social
 오늘의 운세    월   일 금요일  음력   월  일    ,Social
법원  정진상 구속적부심 기각 구속 유지,Social
 서해 피격  서훈 전 국가안보실장 소환,Social
 대통령 전용기에 기자 탑승  헌법소원  요건 미비로 각하,Social
     프레스룸   계약 파기하겠다 에 조두순 아내   배 돌려 달라 ,Social
머리뼈에 구멍  딸 시신  년 동안 김치통에 숨긴 친모  양육수당 부정수급도,Social
자율인 듯 자율 아닌  청계천 자율주행버스  아직은 난제,Social
헌재  육군훈련소 종교행사 참석 강제는 위헌 종교자유 침해 ,Social
 인천 층간소음 갈등    대  항소심도 징역   년 일가족 살인미수 혐의,Social
검찰   정치자금법 위반  강용석 자택 사무실 압수수색,Social
        와 벌인 민사소송  심  건  승소 ,Social
새벽 의식불명 빠진 누나   알고보니 유산 다툰 동생 짓,Social
허위 수사 기록 꾸며 특별 승진한 경찰관 불구속 기소,Social
사기 주범까지 속이고     억 수입차 투자 사기범 추가 구속,Social
아동 성학대 전과 공무원  영구 임용제한 헌재  헌법 불합치 ,Social
    서해 피격  서훈 전 국가안보실장 소환 조사   박지원 조사도  초읽기 ,Social
조두순  이사 포기 보증금 위약금 돌려받아,Social
아동 성적 학대범  공무원 임용 영구 제한 헌재  부당  헌법불합치 결정,Social
화물연대는 왜 총파업에 돌입했을까 ,Social
 카메라 없는 길에세워달라  택시기사  전자발찌 훼손 도주범 검거 기여,Social
 후원금 유용 의혹  강용석 자택 가세연 사무실 등 압수수색,Social
신규 환자 목요일 기준   주 만에 최다    접종 확진   일 뒤 개량백신 가능 ,Social
      유공자 명단 공개 주장  홍준표  묘역 참배 취소,Social
 아내 두 아들 살해  남성  국민참여재판 신청,Social
 조두순 이사 막겠다  쇠창살 트럭까지 동원한 주민들,Social
한동훈  김의겸은 사과할 필요 없어  그 분은 책임을 지셔야 ,Social
우루과이전  카운트다운   광화문에  만    여명 모인다,Social
조두순  결국  위약금  받고 이사 포기 다른 지역으로 옮기나 ,Social
술 취한 채 지하철서   폭행 경찰  현역 공군대위 체포,Social
조주빈  징역  개월 추가   년  개월 복역 후 출소,Social
포항 철강공단 물류 차질 현실화 현대제철 포항공장 하루  천  출하 못해,Social
검찰  강용석 자택 압수수색 선거법 정치자금법 위반 혐의,Social
이호진 전 태광 회장   주식처분 명령 불복   심도 승소,Social
경찰     개월 딸 시신 김치통 은폐  친모 자택 친정집 압수수색,Social
경찰  긴급상황 보고 방식에 스마트폰 앱 시스템 도입한다,Social
대구지하철   년 만에 멈추나  노조    월  일 전면파업 예고,Social
박찬욱감독  강수연  대중문화예술상 은관문화훈장 수훈,Social
원치 않은 아이 출산 후 방치해 숨져  부모  항소심서도  집유 ,Social
화물연대 파업으로 충북 시멘트 출하     급감,Social
갓난아이 변기에서 죽게 한     항소심  집유  이유는 ,Social
   억 원 횡령  조국 전 장관  촌조카 장인  심도 집행유예,Social
만취 상태로 지하철역서 시민 폭행한 현역 공군 대위 체포,Social
폐배터리서 리튬만 쏙쏙 영풍  세계 최초  건식용융  재활용공장 가동,Social
돌봄 급식 종사자 내일 총파업  최대  만 명 참가 ,Social
오월단체 반발 때문  홍준표 시장     묘지 참배 돌연취소,Social
조두순 어디로 이사가나   안산지역 공인중개사 업계  초긴장 ,Social
허위 수사기록으로 특진까지    충주 경찰관 불구속 기소,Social
헌재   손글씨 피켓  낙선운동 처벌한 선거법 개정 필요 ,Social
화물연대 파업에 인천항 화물 반출입량     감소,Social
 축산 악취 때문에 못 살겠다  고통 토로하는 제주 주민들,Social
드론 한 번 뜨면 어린 묘목    그루가 순식간에 산 정상으로,Social
 치킨전쟁           상대 민사소송  심도 승소 배상액은 급감,Social
 보고서 삭제 지시  전 서울청 정보부장 조사    이임재 재출석,Social
 장애인 돕고 싶어  청주시에  억원 현금다발 전달한   대,Social
조두순  선부동 이사 못한다  계약파기  보증금 위약금 돌려받아,Social
한동훈  저질음모론 부추긴 이재명 등 사과하라 김의겸은 법적책임 ,Social
 선거비용 사적 남용 의혹  강용석 변호사 자택 압색 검찰  강제수사,Social
화물연대 파업 참여율      민노총  투쟁 승리  정부  정당성 없다 ,Social
 골로 간다 에 숨겨진 민간인 학살의 진실,Social
원희룡 국토교통부 장관  화물연대 파업 민생 경쟁 혈관 막는 것 ,Social
고양시  테슬라 제조공장 유치하겠다 ,Social
대전경찰   먹튀  의혹 스타일브이 오시싸 피해자 확보 주력,Social
편의점 비닐봉투 음식점 종이컵 사용 금지 첫 날  계도기간이니 신경 안 써 ,Social
제주       도시기본계획  공청회  제 공항 기정사실화  반발도,Social
검찰  후원금 유용 의혹  강용석 변호사 자택 사무실 등 압수수색,Social
 이재명 최측근  정진상 구속적부심 기각 검찰 수사 탄력,Social
골프장 대표에게    만 원 상품권 받은 경찰 간부 실형 구형,Social
           소송전   영업비밀 침해  불인정  손해배상액 줄어 종합 ,Social
이태원 참사에 소상공인 매출     감소  서울시    억 긴급지원,Social
헌재  육군훈련소 장병에 종교행사 참석 강제는 위헌 ,Social
아동 성범죄 전력있어도 공무원 가능  헌재  영구임용 제한 안돼 ,Social
 세번째 아시아 이변 주인공은 손흥민  동북고 선배의 기도,Social
용산 양산  집회금지  맞바꿔  기본권 후퇴  민주당 손쉬운 선택,Social
대법원  미성년 자녀 있는 성전환자도 성별 정정 가능 ,Social
