titles,category
  수익률 최고      라는데   퇴직연금 옮겨볼까,Economic
나이 들면 의료비 걱정 건강종신보험이 해결사  보험      활용법 ,Economic
 르포  준비된 머그컵 금세 소진  곳곳서 불편 호소하자 플라스틱컵 내줘,Economic
  월     서  금리인상 속도 조절해야    고환율 잡히나,Economic
  하이닉스  낸드 점유율  위로 밀려나     키옥시아  위로 부상,Economic
경제 단체  경제 복합위기 심화 화물연대 파업 철회해야  종합 ,Economic
원희룡  서울 부동산 규제해제 아직 아냐 정상화 기능 클 때 검토할 것 ,Economic
겨울 날씨 따뜻해도       세대 옷 잘 팔렸다,Economic
  전자  류재철    본부장 사장 승진   년생 임원 발탁  눈길 ,Economic
 비혼 지원금 도 나왔다  결혼 축하금 과 동일  기본금       일 휴가 ,Economic
 포니 쿠페  복원하는 주지아로  전설  난 그저 연필 노동자 ,Economic
고팍스  코인예치 서비스  고파이  출금 전면 중단     사태  불똥 ,Economic
낡은 구찌를     최애 로 만든 디자이너 미켈레  회사 떠난다,Economic
한전채 발행한도    조로 늘린다지만 채권시장 쏠림 어쩌나,Economic
경제 단체   경제  복합위기 우려 화물연대 파업 철회해야  종합 ,Economic
     회사 쪼개기  불구  이우현 부회장 지배구조 멀었다,Economic
금리인상 속도조절에 안도한 코스피 상승 틈 타 또 개인만 팔았다,Economic
코스피  외인 기관 쌍끌이 순매수에 상승      대 종합 보 ,Economic
안전운임제 적용 제외 화물노동자 목소리 커진다  차종 품목 확대해야 ,Economic
 엔비디아  홍콩 물류센터 대만으로 이전 ,Economic
 전설의 부활   정주영 꿈   포니 쿠페    년만에 환생,Economic
            년 주식시장 전망은,Economic
편의점 비닐봉투 카페 플라스틱 빨대 퇴출에 제지   강세 ,Economic
엔켐    현지  차전지 소재 생산 거점확보      업체 등 고객 다변화할 것 ,Economic
 못생겨도 싸니까   가성비         쟁여두자  짠테크로 사는 법,Economic
계속 오르는 금리   전문가들  문제는 내년  부동산 급락 가능성 ,Economic
경제  단체  운송거부 철회  안전운임제 폐지해야 ,Economic
         년   자율주행시장     억 달러   톱픽은 테슬라와 벤츠 ,Economic
 금리인상 속도조절론  원 달러 환율   원 급락,Economic
최종 금리상단      유지   이자 부담시점만 늦춰,Economic
빈 살만 테마주 찾기  가시성 높은 분야 투자해야 ,Economic
한은  내년 경제성장률   대로  뚝  물가는 고공행진  이중고 ,Economic
  전자   고객경험센터  신설  가전 전문가  류재철 본부장  사장 승진,Economic
 코스피 마감    금리인상 속도조절  베이비스텝에    ,Economic
         집값 급락 공시가보다 낮은 거래 속출,Economic
 코스피 마감    금리인상 속도조절  베이비스텝에    ,Economic
 급매물만 거래   서울 아파트값  역대 최대 하락,Economic
안전운임제 시멘트 운송차량 지원내역 살펴보니   숙박비 통신비까지,Economic
                  최종 기준금리 어디까지  증권가 전망 엇갈려,Economic
 재산     내놓겠다  약속한 워런 버핏  조원 또  통 큰  기부,Economic
화물연대 파업 첫날부터 손실 현실화 철강 시멘트 출하  중단 ,Economic
현대제철 노사  첫 교섭 나선다 노조 게릴라 파업 유보,Economic
보험 카드 사은품 늘어난다 렌터카 편도 영업도 허용,Economic
 테슬라 납품  프라이맥스  올해     억원 매출 돌파,Economic
 종합          중책 맡은 정호영      신규 임원과 사업구조 재편 가속,Economic
금리인상  앞으로    번이면 끝난다    최종금리           ,Economic
경제 단체 긴급 기자회견  경제위기 극복 위해 힘 보태달라  종합 ,Economic
 르포 일회용품 사용제한 첫날    계도기간인데 지켜야하나 ,Economic
경제 단체장  화물연대 운송거부 철회해야 ,Economic
원달러 환율   원 급락     원대 후반 마감 종합 ,Economic
카카오뱅크  찐반등  아니었나 증권사 목표주가 줄하향,Economic
내년 기준금리     까지 간다 경기침체 속  딜레마 ,Economic
골드만삭스  넷마블 크래프톤 팔고 텐센트 사라 ,Economic
  전자   미래 준비  방점 인사 류재철 사장 승진,Economic
한덕수 총리  이태원 참사  국조 증인  출석하겠다 국회 존중 ,Economic
 매각도  회생절차도     메쉬코리아 유정범  법정싸움 나서나,Economic
 계획된 적자  이론 증명될까 창사 이래 첫 흑자 꿈꾸는 쿠팡과 배민,Economic
겨울 앞둔 한국 경제  내년      성장  잠재 수준 하회  종합 ,Economic
원 달러 환율  연준 속도조절론에     원 급락        원 마감,Economic
   그룹 첫  여성 사장  호  이정애 퇴임하는  샐러리맨 신화  차석용 누구,Economic
기준금리 인상 속도  제동  이창용  최종 금리            종합 ,Economic
 믿고 보는 송중기     재벌집 막내아들  흥행에 이 종목  상한가 ,Economic
 종부세 때문에 파산지경  올해도  폭탄에 비명  매부리레터 ,Economic
수도권 규제지역 대폭 풀었지만 아파트값 더 내렸다 역대급 하락,Economic
수선해 되파는  바이백  점점 대세로 중고 시장의 미래는,Economic
  년 넘어   년으로    로얄살루트     만원대 고연산 위스키 정규 출시,Economic
   권봉석 부회장 유임 지투알  첫 여성 대표 선임,Economic
엔켐     차전지 소재 생산거점 확보  고객 다변화 ,Economic
  전자      년 임원인사 단행 류재철    본부장 사장 승진,Economic
적막감마저 감도는 의왕    비노조원들도 화물 운송 거부 동참,Economic
 스타벅스 이어 디즈니도  돌아온  부메랑     들 역대 성적은,Economic
가품 논란 리셀 금지 중고 시장 신뢰 회복 절실,Economic
     화학부문 인적 분할 추진    하락 마감 종합 ,Economic
화물연대 파업 타격 본격화 시멘트  출하 중단  레미콘  셧다운 ,Economic
 마켓인 산은 덕에   라이브시티 자금 숨통 장기    발행,Economic
 르포  필립모리스의 꿈 이뤄낼 양산공장  담배연기 없는 미래  만든다,Economic
 축구장  개 물 퍼냈다  태풍이 할퀸 포항제철소 복구 기적,Economic
경제 단체  한국 경제 복합위기 화물연대 파업 철회해야 ,Economic
 베이비스텝 이라지만  서민 기업 이자 부담  껑충 ,Economic
  디스플레이  정호영 사장 유임 공식화     년도 임원인사   명 승진,Economic
  전자    센터 신설해 고객경험 혁신 속도  류재철 사장 승진,Economic
내년  경기 한파  온다 한국 경제   대 성장 그칠 듯 종합 ,Economic
 문답  이창용  베이비스텝 만장일치 내년 성장률     는 보수적 전망치 ,Economic
  디스플레이  정호영 사장 유임   위기 속 사업재편 가속화 나선다,Economic
시몬스에 위협받는 에이스침대     공략법 벤치마킹 ,Economic
  전자  류재철    사업본부장 사장 승진   대 최연소 임원 발탁,Economic
현대제철 노조   게릴라 파업  중단하고 협상 재개,Economic
편의점 일회용품 사용금지 첫날 과태료 없고 혼란은 커졌다,Economic
    등  개 계열사 임원 인사 지투알    에 박애리 부사장,Economic
경제  단체  화물연대 총파업  수출 경쟁력 떨어트릴 것 ,Economic
다올투자증권  희망퇴직 실시  신입 제외 정규직 전원 대상,Economic
철도노조 태업에 무궁화호 등 열차  대 지연 운행,Economic
최동원 선동열 등   야구 레전드    명  우표로 나온다,Economic
상장 한 달도 안 돼 무더기 스톡옵션 행사한 뉴로메카 저스템 투자자만 눈물,Economic
 단독  김문권 이스타항공 대표  연내     발급   외부 투자 유치 중 ,Economic
 단독  김문권 이스타항공 대표  연내     발급   외부 투자 유치 중 ,Economic
세계적 벤처캐피탈  기술주 밸류에이션     년까지 회복 못할 것 ,Economic
아파트값 역대 최대 하락세 지속   규제 완화에도 속수무책,Economic
서울 아파트 가격        역대 최대 낙폭,Economic
금리경쟁에 경고에도 저축성보험   대로 올라가나,Economic
 연말이 코 앞인데 이러다 큰일    돈 안 돌아 회사채 발행 한달새 반토막,Economic
  전자      년 조직 개편 및 임원인사 단행,Economic
이번 경기침체엔 생산직 아닌 사무 전문직에 해고 칼바람,Economic
이창용    월 물가상승률 상당폭 하락   금리인하 논의 시기상조 ,Economic
 나 보기가 역겨워  김소월   넥타이 맨 이창용  차주 위로 메시지 ,Economic
한덕수  내년엔 올해보다 더 어려울 것      안팎 성장 전망 ,Economic
  생활건강 이정애 대표 발탁  대그룹 첫 여성 전문경영인 사장 종합 ,Economic
금융위  예대율 산정 시  안심전환대출  제외  은행  숨통 트여 ,Economic
중소형 증권사         매입 본격화 증권업계 숨통 트이나,Economic
    러 원유 가격 상한제 합의 실패,Economic
한총리  내년 성장률   안팎   김여정 예의 안지켜 유감 ,Economic
     국가채무비율     년        국민연금     년 완전고갈 ,Economic
 대통령 머스크 통화 호재됐나   테슬라 오랜만에    폭등,Economic
화물연대 총파업에 건설업계도  타격  둔촌주공 또 공사중단 위기,Economic
화물연대 총파업 첫날  철강 시멘트   산업계 곳곳서  운송차질  종합 ,Economic
     인적분할에 숨은 매력 찾을까 주가는  뚝 ,Economic
신라스테이  국내 호텔 단일 브랜드 최초로 연    만 객실 판매 돌파,Economic
정부      년  세계  대 방산 수출국  추진 핵심 기술 개발 인력 양성,Economic
서초 이수 아파트 재건축 수월해진다  서울시  지구단위계획 전환 안건 통과,Economic
이창용  금통위 다수 최종금리 연       바람직       가능성도  종합 ,Economic
화물연대 파업 첫날 정부 추산     여명 참여   물류피해는 발생하지 않아,Economic
 반지하 지상층  이주땐  년 간 월   만원 지원한다,Economic
떠나는  샐러리맨 신화  차석용     생건 매출      로 키워,Economic
   광고 지주회사 지투알    에 박애리,Economic
 자사주 맞교환  고려아연 한화  주가 떨어지는 이유,Economic
올해 마지막 금통위  베이비스텝  증권가  주가에 선반영 ,Economic
로얄살루트   년 출시     병에    만원대  한국 배정 물량은 수천병 ,Economic
주차장 키오스크 앞에서  시간 헤매 표준 안 지켜  약자들  골탕,Economic
 일문일답  이창용  기준금리 인상  가계대출 리스크에 긍정 효과 ,Economic
경제성장 정체인데 고물가 지속 내년도 암울,Economic
지분 매각에  언론장악      민영화  밀어붙이기 ,Economic
한은도 내년 성장률 전망     로 대폭 낮춰 물가는       종합 보 ,Economic
테슬라  바닥 찍고 하루새    반등했는데 향후 주가 전망은 ,Economic
라이더유니온 민주노총  오늘  쿠팡이츠  배달 멈춘다  배달료 인상  요구,Economic
증권가 구조조정  바람  다올  희망퇴직 단행,Economic
  월      의사록  긴축 속도는 조절  금리 종착점은 불확실 ,Economic
 몸만 오세요  호텔급 서비스에 아파트 수준의 평면까지  제주  르컬렉티브 까사마리나  인기,Economic
 완성차 출고 복구 지연 우려    철강 업계  화물연대 파업에  촉각 ,Economic
 주식 부자  위  조정호 메리츠금융그룹 회장의 남다른 행보,Economic
 이앤피  이태원참사 유족 인터뷰 시간 흘러도 눈물이 멈추지 않아 ,Economic
경제 단체  화물연대  일방적 운송거부 즉각 철회해야 ,Economic
  년 만에 돌아온 전설의  포니 쿠페  현대차 주지아로 손잡고  원형 복원 ,Economic
아파트 매매 전세가 모두 역대 최대 하락 추가 하락세 불가피,Economic
폭스콘  시위 나선  노동자에  돈줄게 사표내라  제안,Economic
   광고 지주사 지투알 신임    에 박애리 부사장 선임,Economic
주택담보대출 금리      기록할 듯 내년엔    대 가능성도,Economic
귀뚜라미 카본매트의 진화  아라미드 열선  난방 강화,Economic
 단독   일 이어진 현대제철 게릴라 파업 멈춘다,Economic
포니 쿠페   년만에 세상 나온다  포니 생산은 기적 같은 일  종합 ,Economic
석 달 지난  포항제철소 침수 사태   내년  분기 완전 정상화  종합 ,Economic
한총리  내년 경제성장   언저리 물가 올해보다 낮지만     대 ,Economic
권봉석 부회장 유임    등  개사  내년 임원 인사,Economic
   아이앤콘스   영주 아이파크  전 주택형 순위 내 마감,Economic
포스코  연내 전 제품 공급 가능    화물연대 파업 변수  르포 ,Economic
 분기 일자리    만개  늘었다지만    는 중노년층 몫,Economic
점점 커지는 시계 중고 경매 시장 정희경의 시계탐구    ,Economic
 기준금리 추가 인상 확실  부동산 시장 반전 없을것 ,Economic
경제 단체장  화물연대 운송거부 철회 안전운임제 폐지해야 ,Economic
카셰어링 영업구역 제한 풀린다 마트 새벽배송 허용은 보류 종합 ,Economic
 이자 뛴다  빚부터 갚자  오너들 결단 주식담보대출 속속 정리,Economic
조제 감기약 값 최대     인상에도 해당 제약사 주가  잠잠       바이오 ,Economic
전기차 충전 시 배터리 잔여 수명 알려준다   온   시그넷 공동 개발,Economic
 재벌집 막내아들  흥행 대박 예감   래몽래인      신고가 ,Economic
전국 아파트값 최대 낙폭   주째 경신   내년 상반기 낙폭둔화 전망,Economic
  전기차  위 비야디의 역주행   테슬라와 달리 가격 인상,Economic
사티아 나델라         정육각  단독 회동 ,Economic
 노도강  아파트 또 큰 폭 하락    연말까지 지난해 상승분 모두 반납할 듯 ,Economic
 월급 인상  약속하더니 감감   아이폰 공장 노동자들 폭발했다 영상 ,Economic
경제 단체  노란봉투법 안전운임제 폐지    법인세  상속세도 인하를 ,Economic
이창용  최종금리     가 대다수 금리인하 논의는 시기상조  종합 보 ,Economic
민 군 방산 기술협력에  조 투입   주도  포스트 세일즈  활동 전개,Economic
 성공예감  지금까지 속았다 경제기사 똑바로 읽는 법   이상민 수석연구위원 나라살림연구소 ,Economic
시멘트 출하 사실상 전면 중단   월보다 피해 커질라  우려,Economic
텐센트홀딩스  신규게임 잇따라 매출전망  쾌청   서학개미 리포트 ,Economic
 투자 혈맹 합작            기회 안 놓친다,Economic
   소상공인   곳 중  곳 대출 늘었다 절반 이상  자금 악화  호소,Economic
한미약품   신약 운명의 날  연타석 홈런 될 확률    ,Economic
아파트값 매매 전세 역대 최대 하락 이어가      대 급락,Economic
   번 충돌 위험 모두 피했다  목포서 출발한 자율운항 선박  독도까지      순항 대성공,Economic
    년 세계 경제 어디로  침체    반등 예측 엇갈려,Economic
    등  개 계열사 임원 인사    지투알    에 박애리 부사장,Economic
부산 시내버스 기사  의식 잃고 쓰러진   대 승객 구조,Economic
정부  국가경제 볼모  엄정대응  원희룡 한동훈 윤희근 등 담화발표,Economic
세운철강  부산 넘어  전국 대표 철강기업 으로 ,Economic
 출하 못해 공장문 닫아야 할 판  화물연대 파업에 시멘트는  한숨만 ,Economic
 올 겨울 가볍게 떠나세요  대한항공   코트룸 서비스  시작,Economic
 상선 미츠이 크루즈선에     억엔 투자  컨테이너 의존 탈피 ,Economic
수처리 풍력 모듈러 강자 코오롱글로벌  네옴시티 도전장 내밀어,Economic
 대 시중은행장 만난 이영 장관    고 복합위기 장기화 대응    꾸리기로,Economic
청계천 자율주행 버스 운행 시작,Economic
    임원 인사   미래 준비  방점 권봉석 부회장 유임,Economic
토스뱅크      억원 유상증자 단행 하나카드  주주 합류,Economic
한은  내년 상반기까지 경기 침체  고물가 이어져 ,Economic
증권가 내년 최종금리 전망 엇갈려                 ,Economic
포티투닷 자율주행 셔틀  상암 이어 청계천 달린다,Economic
   세대  포니 알아    현대차  전설의   디자이너 다시 찾은 이유,Economic
 화물연대 운송거부 노조법 개정 중단해야   경제 단체 공동성명,Economic
경제 단체  경제 위기 심각 화물연대 운송거부 즉각 철회 해야 ,Economic
  건설  서울 성북  장위자이 레디언트  분양 중도금 전액 이자 후불제,Economic
패키지 여행에   세대 예약률     대 증가,Economic
자율운항  상용화 눈앞에 대형선박 충돌회피 성공,Economic
가상화폐 발행   직원 용역비까지 교묘해지는  탈세  수법,Economic
트리플 역세권으로 비상하는 시청시청역  현대 테라타워 시흥시청역  눈길,Economic
 최장수      차석용   생건 부회장 물러난다   그룹 첫 여성 사장 등판,Economic
경제  단체  대국민 호소   화물연대 운송거부 노조법 개정 중단해야 ,Economic
 일문일답  이창용  단기자금시장 불안 한은도 필요한 역할 할 것 ,Economic
 영상 테슬라 비관론자의 변심    빠질만큼 빠졌다 ,Economic
 파산 신청      창업자  이럴 줄 몰랐다  사과,Economic
 화면 속 상품 바로 구매  유튜브 올라탄 유통가 라방 협업,Economic
 소로스는 늘리고 버핏은 줄이고    월가 전설의 엇갈린 전기  투자,Economic
 다음 주면 더 떨어질텐데  매수세 실종에 아파트값 또 최대낙폭,Economic
병원 의사 제약사 보건의료 정기국회 종료 앞두고  쟁의의 계절 ,Economic
  국민은행  티맵 대리기사 전용 비상금 대출 출시,Economic
    년까지 원전 발전비중      로 늘린다,Economic
토스뱅크      억 유상 증자 신규 주주로 하나카드 합류,Economic
보험 들면 스마트워치 받는다  선물 한도  만   만 원,Economic
 혁신 아이디어만 챙겨오세요 나머진 삼성이      랩 아웃사이드  졸업식 개최,Economic
코스피 장 중      터치 외인 기관 동반  사자 ,Economic
토스뱅크   천억원 유상증자 결의 하나카드 신규주주 합류,Economic
한은  경기둔화 언급하며  베이비스텝   연준서도 속도조절론  이종화의 세돌아이 ,Economic
화물연대 총파업 전국서 동시 출정식 첫날     참여,Economic
추락하는 집값  하락폭 또  역대 최대  서울 아파트값   주 연속 내리막,Economic
정부   세계  대 방산 수출강국  선언 수출 전략산업으로 키운다,Economic
 화물연대 파업 노조법 개정 중단  경제  단체 긴급 기자회견,Economic
         년 국가채무비율      교육교부금 개편 증세해야 ,Economic
버핏  자녀들 재단 등에  조원 또  통큰  기부,Economic
포스코     산업부 수해 피해 놓고 입장차  점입가경 ,Economic
    등  개사 임원인사 박애리 지투알     선임,Economic
권봉석    부회장 유임 지투알  첫 여성     선임,Economic
경제 단체  경제위기 극복 위해 화물연대 파업 철회해야 ,Economic
한은  기준금리        인상   성장률     로 하향,Economic
 겨울철 서민연료  등유 가격 너무 뛰었나   정부  특별점검반 만들어 가격 잡는다,Economic
동아오츠카  평균      가격인상 포카리스웨트        원 ,Economic
경제 단체  경제위기 심각  화물연대 파업 중단하고 노조법 개선 ,Economic
경제 단체장  화물연대  일방적 운송거부 즉각 철회하라 ,Economic
  생활건강     년 최장수      차석용 부회장 용퇴,Economic
미래와 현재 가치  모두 담다  포레나 대전학하  분양 돌입,Economic
 속도조절  금리상단     선 유지    물가안정 수렴까지 인상기조 ,Economic
무일푼에 주택 사들여 세입자 보증금    억  꿀꺽 한   대,Economic
최고가   억 아파트도  억  뚝    도저히 바닥이 안 보인다,Economic
    년 석탄발전 비중     아래로 줄인다 원전은      ,Economic
 트렌드경제    와 코로나가 불러온 주류 시장 변화 소주 보다 위스키 와인이 대세,Economic
최대   년 전세  군산 신역세권  영무파라드 라이브시티    월   일 오픈 예정,Economic
베이비스텝 금융당국 권고   영끌족 숨통 트이나,Economic
시멘트업계  화물연대 불법파업 중단해야 ,Economic
서초 이수 재건축 쉬워진다 아파트지구 지구단위계획 전환,Economic
 대주주 적격성   심에서도 태광 이호진  승소  금융위 항소 기각,Economic
 급급매 아니면 쳐다도 안 봐요  서울 아파트   주 연속 하락,Economic
 집값  얼마나 더 떨어져야  영끌 성지  노도강   끝 모를 추락,Economic
 년 만에 금리  배 넘게 뛰었다  은행 대출도   대 전망,Economic
 현장  전설의  포니 쿠페     년 만에 재탄생 현대차 주지아로  맞손 ,Economic
  건설   장위자이 레디언트  이자 후불제 분양,Economic
원전 이어 방산에 눈돌리는 정부     년  대 수출 강국 정조준,Economic
한은  내년 성장률     로 낮춰 물가는     로 하향 종합 ,Economic
기준금리        인상 내년 성장 전망     ,Economic
서울 아파트값  또 낙폭 신기록 전셋값도 동반추락,Economic
치킨업체 한국 월드컵 첫 경기 앞두고 마케팅 열전,Economic
 서 트랙터 팔아  대박  슈퍼개미도 노렸던 한국의  이 회사   안재광의 대기만성   ,Economic
    명 대기한 전국 화물연대 출정식 첫날 참여율     종합 보 ,Economic
 해도해도 너무한다  화물연대 파업에 시멘트 업계  절규 ,Economic
 분기 임금 일자리   만개  절반이   대 이상,Economic
 이사 엄두도 못내요  아파트값 역대 최대 하락 행진,Economic
  생건  실적 위기에  쇄신    년 만에 수장 교체,Economic
 일문일답 이창용    대 물가 나와도 금리 낮추는 시그널 아냐 ,Economic
카카오모빌리티  택시기사 의료생계 지원 인당 최대      만원,Economic
    년 원전 비중      안정적 전력수급  최우선 과제로,Economic
 삼성이 육성해주고 테스트베드까지    글로벌 스타트업 키우는  랩,Economic
인천국제공항  세계 최초 항공기 지상이동   내비게이션 운영 성공,Economic
토스뱅크      억 유상증자 하나카드 주주 합류,Economic
한국 경제  겨울이 온다  내년      성장  잠재 수준 하회 ,Economic
서울시  반지하 지상층 이주 시 최장  년간 월   만원 지원,Economic
정부  민 군 협력에   조  투입   대 방산 수출국 도약 ,Economic
  그룹 첫  사장 이정애     년 차석용   생건 체제  어떻게 바꿀까,Economic
파죽지세 콘텐츠  래몽래인 덱스터 급등  증시이슈 ,Economic
 전용        억  장위자이 레디언트  중도금 이자 후불제,Economic
해외여행 수요  국내 여행업계 글로벌 시장에 사활,Economic
메리어트  국내 최초 듀얼 브랜드 호텔 선봬 르메르디앙 목시 명동 개관,Economic
토스뱅크      억원 유상증자 자본금 총  조    억원,Economic
태영건설 컨소   동탄 어울림 파밀리에 숨마 데시앙  본격 분양,Economic
대구 주간 아파트 매매가            년  월 이후 첫     대,Economic
충전기 꽂으면   배터리 수명 진단   온 시그넷 서비스 추진 업무협약,Economic
사우디 네옴 부산엑스포 맞교환  외교부장관  사실 아냐 ,Economic
  중공업  해군 고속정  척 수주  전투함정 건조 독보적 기술 입증,Economic
머스크 투자 발언에 고양시  우리가 기가팩토리 유치 최적지 ,Economic
동원그룹  대표이사급 인사 이명우 동원산업 사장 부회장 승진,Economic
  명 중  명  키오스크  이용 불편 경험   대 이상 만족도 낮아,Economic
 오늘보다 내일이 싸다    년전   억  고덕   평 간신히   억,Economic
장기 민간임대    년 거주 가능,Economic
서울시  반지하에서 지상층 이주 가구 월   만원 지원,Economic
         년 최악시 국가채무비율      부가세 소득세 올려야 ,Economic
정부  무관용 원칙으로 대응   업무개시 명령도 검토 ,Economic
화물연대 파업 첫날 완성차 타이어업계도  운송  차질,Economic
저비용항공 인천    탑승률  대형사보다 높네,Economic
 김대호의 경제읽기  한은  기준금리         내년 성장률      전망,Economic
서초 이수 아파트지구  지구단위계획 전환 재건축 쉬워진다,Economic
기준금리 인상에 가계 이자부담   개월 새   조원 급증     내년에는 더 오른다는 데 ,Economic
시멘트업계  화물연대 파업  명분 없는 운송거부 ,Economic
