titles,category
경제계  호주는 안전운임제 부작용에 폐지     대상 늘려야 ,Politics
민주  안전운임제 일몰제 폐지 품목 확대 노력 국토부  대화 나서라 ,Politics
   오늘 화물연대와 간담회    안전운임제 확대 논의 ,Politics
민주  안전운임제 일몰제 폐지 안전운임 품목 확대해야  화물연대와 간담회,Politics
캄보디아 대사   빈곤 포르노  논란에  지나친 정치화 ,Politics
주한 캄보디아 대사  우린 김 여사 친절 고마운데  지나치게 정치 이슈화 ,Politics
대통령실 고발에 장경태  김건희 여사가 세금 들여 고발한 것 ,Politics
캄보디아 대사  김건희  환아 지원 매우 감사   비판엔  지나친 정치화 ,Politics
기니만 해상서 해적에 억류된 선박 하루 만에 풀려나 한국인  명 안전,Politics
기니만서 해적에 억류된  선박 풀려나 한인 명 승선 종합 ,Politics
 속보   기니만서 억류된  급유선 하루만에 풀려나 한인 명 탑승 ,Politics
한인 탑승 급유선 기니만서 해적에 억류 하루 만에 풀려나,Politics
 역대 최장기 표류  오석준 대법관 후보 임명안 본회의 통과,Politics
윤석열 대통령  오석준 대법관 임명 재가  제청    일만,Politics
인준 통과된 오석준  국민 누구나 수긍할 수 있는 판결 하겠다 ,Politics
오석준 임명동의안    일 만 통과  균형 있는 판결 위해 성심 다할 것 ,Politics
민주당    대통령    일까지 이상민 장관 파면 조치 내놔야 ,Politics
    이상민 해임건의 탄핵  검토  책임 엄중히 묻겠다  종합 ,Politics
 김기현  조국 추미애 궤변 흑역사  이재명 고민정 김의겸 장경태로 릴레이 ,Politics
 정진상 구속 유지 에   김기현  사필귀정  이재명 숨바꼭질 끝났다 ,Politics
   화물연대 파업 연일 맹공  국민 경제 볼모로 잡고 이기주의적 요구 ,Politics
   화물연대 파업 엄정 대처    민주  안전운임제 확대 ,Politics
대통령실  화물연대 파업  업무개시명령 불응시  법적조치 ,Politics
윤 대통령  화물연대 운송거부 지속하면 업무개시명령 등 검토 ,Politics
  지지율     복귀 부정평가는 여전히    대 한국갤럽 ,Politics
   도어스테핑 계속해야          중단해야       팽팽   갤럽 ,Politics
주호영     말로는 협치 뒤로는 뺨쳐 예산 폭거 멈춰라 ,Politics
   예산 삭감한    정부 일 못하게 하려는 정부완박 횡포 중단해라 ,Politics
이재명  검찰  수사를 해야지 쇼해서야  언제든 털어보라 ,Politics
침묵 지키던 이재명  유감 표명 대신  에  털어봐라  공세,Politics
정성호  이재명    소환할 때쯤 입장 표명할 것 ,Politics
정성호  이재명  피의자 소환조사 통보받더라도 대표직 유지해야 ,Politics
 식량난  북한  남포항 등서 곡물포대 추정 물체 지속적으로 포착,Politics
배고픈   결국 국경 문 여나 송림항서  하얀 물체  포착됐다,Politics
유인태   이   인간자체가 싫다 했다더라 ,Politics
대통령실    대통령  이재명 자체가 싫다  했다  사실 무근 ,Politics
규제개혁위 민간위원에 안완기 생산성본부 회장 등  명 신규위촉,Politics
권남훈 교수 등  명  규개위 신임 민간위원 위촉,Politics
    김일성 휘장  시신 끝내 인수 거부 통일부  화장 방침,Politics
   주민 시신 인도  반응 통일부    일까지 답없으면 무연고 처리 ,Politics
 공덕포차  윤 대통령  도어  스톱핑  뭐든 물어보라더니,Politics
 공덕포차 엑기스        악의적 가짜뉴스  그럼 진짜뉴스는 뭔데 ,Politics
 공덕포차 화요우당탕   적반하장 소통  도어스테핑 중단,Politics
한국   강  필승 전략  있다  공덕포차 월드컵 스페셜 ,Politics
    시간씩 기다렸다  한국팀 월드컵 예선 첫날  치킨 주문 폭주,Economic
 집관족 에 치킨 잘 팔린다    월드컵 대목 에 매출 벌써 들썩,Economic
   치킨  한국 축구대표팀 경기 첫날 가맹점 매출      증가,Economic
 축구 응원에는 치맥이지  치킨업계  월드컵 특수  톡톡 ,Economic
 건보 재정  년 뒤 고갈   적극적 재정통제 관리체계 구축해야 ,Economic
 향후   년  마지막 재정개혁 기회    대 전략 수립 ,Economic
기재차관  향후     년이 재정 개혁 마지막 기회 국민연금 개혁하고 기후 대응 재정체계 만들 것 ,Economic
기재차관  향후     년  마지막 재정개혁 기회  대 전략 수립 ,Economic
제주 드림타워   제주 밤  수놓는 미디어아트 선봬,Economic
제주 드림타워 리조트  크리스마스 미디어아트 점등 개시,Economic
롯데관광개발  제주 드림타워 외부 미디어 파사드 점등 시작,Economic
제주 드림타워  크리스마스 미디어파사드 시작,Economic
전경련  프랑수와 필립 샴페인 캐나다 장관 초청 간담회  광물공급망 협력 ,Economic
한국 캐나다  전경련 간담회서  광물 공급망  경제협력 뜻 모아,Economic
산업계 공동성명  노동계 총파업은 집단이기주의 즉각 중단하라 ,Economic
  개 업종별 단체  국민 기업 볼모로 하는 노동계 총파업 중단해야 ,Economic
 내년 글로벌 성장률 금융위기 직후 수준  유럽이 타격 가장 클 것 ,Economic
     년 글로벌 성장률       금융위기 직후 수준 ,Economic
   온  인니에 니켈 중간재 생산공장 설립 추진 기업 ,Economic
  온  에코프로    과 인니에 니켈 중간재 생산법인 설립,Economic
화물연대  무기한 총파업 돌입 정부  운송개시명령 준비  엄정 대응,Economic
전국   곳서 동시다발 출정식  무기한 운송 거부 ,Economic
서울 아파트 매수심리   년만 최저   주 연속 하락,Economic
 매매 전세 살 사람 없다  서울 아파트 매수심리   년 만 최저,Economic
교보생명  대한민국 지속가능성지수   년 연속  위,Economic
교보생명   대한민국 지속가능성지수    년 연속  위,Economic
  바이오사이언스      평가 전 부문  등급 획득,Economic
  건설               평가서 등급 상향   종합     획득,Economic
광화문 채운 월드컵 열기 일대 편의점 매출 최대 다섯 배  껑충 ,Economic
 영상 편의점 맥주 매출 열배 늘었다 유통가 월드컵 특수,Economic
 누구템  국뽕 차오르게 한     정국 월드컵 개막식서 입은 재킷은,Economic
 누구템  정국이는  캉골  버킷햇      멤버 모자 취향은,Economic
 누구템 삼성  셋째 이서현    년간 사랑하는 브랜드,Economic
 누구템  에르메스 마니아  오은영 박사  불가리 행사 패션은,Economic
법원   불법 대선자금 의심  김용  억 추징보전,Social
법원   불법 대선자금 의혹  김용 재산  억 동결   가압류 신청,Social
법원  김용  불법 대선자금 의심   억원 동결 청구 인용,Social
법원  김용  불법 대선자금 의심  재산  억 동결    대장동 일당  재산도 묶여,Social
신촌서 모녀 숨진채 발견  개월 밀린 전기료 고지서만 덩그러니,Social
복지부 대책 발표 전날  신촌에서 모녀 숨진 채 발견,Social
신촌서 모녀 숨진 채 발견 현관문엔  달 밀린 가스비 고지서,Social
신촌서 모녀 숨진 채 발견  현관엔  개월 밀린 전기요금서,Social
  월 일 밤  시  이때부터 택시 타면 요금    까지 더 낸다,Social
다음달  일 밤   시부터 택시요금 올라갑니다,Social
서울 택시  다음 달  일부터 오후   시부터 심야할증,Social
카카오모빌리티  택시기사 의료생계 지원 인당 최대      만원,Social
파업 이틀째 충돌 없이 전국 물류거점에서 선전전  경찰  상황 예의주시 ,Social
화물연대 파업 이틀째   부산항 컨테이너 반 출입량     감소,Social
 화물연대 파업  현대제철 인천공장 철강재 출하 멈춰,Social
화물연대 파업 둘째날 인천항 화물 반출입 차질 악화,Social
 김만배는  이재명 설득용  영입  남욱 유동규 합 맞춰 공세,Social
남욱  이재명  정치자금 문제될까 우려 사업서 빠지라 했다 ,Social
검찰  이정선 광주교육감 선거법 위반  무혐의  처분,Social
 검찰  이정선 교육감  선거법 위반 무혐의  처분 외 간추린 뉴스 ,Social
돌봄 급식 파업  부모는 휴가  아이는 빵  불편호소 속출,Social
서울 학교    곳 급식 차질 비정규직 파업 참여율      ,Social
미국서 가석방된 선상 살인   대 선장  국내서 다시 기소,Social
하와이서 살인 저지르고  년 만에 가석방 검찰  법정에 다시 세운다,Social
 고객 명의   억 대출  전직 농협 직원 징역  년,Social
 고객 명의 도용해   억원 대출  전직 농협 직원   심 징역  년,Social
검찰   구속  정진상 수시 조사 예상    와 연관성 추궁할 듯,Social
이재명 대표 계좌 추적 정진상 구속적부심 기각,Social
경기도   일산대교 무료화 포기 없다  항소,Social
경기도  일산대교 유료화 유지  심 판결 불복 항소,Social
 오징어게임  배우 오영수 강제추행 혐의로 재판 넘겨져,Social
 오징어게임  오영수    강제 추행 혐의로 기소,Social
광주 대구시장  민선  기  달빛동맹  강화,Social
홍준표 대구시장 강기정 광주시장  대구 경북 하늘길 연다,Social
아내 두 아들 살해 후  기억상실  거짓 주장   대   국민참여재판 신청,Social
광명 세모자 피의자  국민참여재판 철회,Social
 먹거리는 역시 전북  지역먹거리 평가서 전국  최초 최다 최고  입증,Social
청양군       먹거리 지수 측정사업 대상 수상,Social
육지로 이송 중이던 외상 환자 들것 채로 바다에 빠져 사망,Social
섬 외상환자 이송 도중 바다에 빠져 숨져,Social
탈모약  아직도 고민만 하고 계신가요   약 읽어주는 안경진 기자 ,Social
탈모약  아직도 고민만 하고 계신가요   약 읽어주는 안경진 기자 ,Social
 바이오시밀러  종 장착  셀트리온 삼바 추격 나선 종근당  약 읽어주는 안경진 기자 ,Social
노벨화학상으로 빛난  클릭화학       신약  몸값도 오를까  약 읽어주는 안경진 기자 ,Social
르노코리아차  협력업체와 중형     등 친환경 신차 계획 공유,Culture
르노코리아  협력업체와 중형     등 친환경 신차 계획 공유,Culture
르노코리아  협력업체와 친환경 신차 계획 공유,Culture
르노코리아  협력업체와 중형     등 친환경 신차 계획 공유,Culture
광림교회 김선도 목사 소천,Culture
광림교회 김선도 원로목사 소천,Culture
감리교 김선도   감독회장 별세   일 광림교회 장례예배,Culture
세계 최대 감리교회 일군 광림교회 김선도 원로목사 소천,Culture
 오늘도 한낮 쾌청하고 온화   밤부터 중부 요란한 비 날씨 ,Culture
 큰 일교차 유의 중부지방 오후부터 비 소식 날씨 ,Culture
  억    만원  롤스로이스 팬텀 시리즈  국내 출시,Culture
롤스로이스  팬텀 시리즈   국내 출시  세대 팬텀의 부분변경 모델,Culture
굿피플  서울시와 함께 소외계층에 생필품  만    상자 지원,Culture
오세훈 시장   사랑의 희망박스 박싱데이 로 온정 전달,Culture
 연말정산 중고차 공제 잊지 마세요 ,Culture
   월의 월급  연말정산  소득공제 더 받는 꿀팁은   손희애 크리에이터  머니클라스,Culture
내일 비 그친 뒤 기온  뚝  오전 수도권 미세먼지 유의,Culture
밤사이 중부 전북에 비 내일 비 그친 뒤 추워져,Culture
 날씨클릭  오늘도 큰 추위 없지만  일교차 커 중부 전북 비 조금,Culture
 날씨클릭  밤사이 기온  뚝   아침 쌀쌀 한낮 온화 안개 주의,Culture
 날씨클릭  오전까지 전국 대부분 비 동해안 호우특보,Culture
 날씨클릭  오늘 오후부터 전국 비 동해안에 최고      ,Culture
부마민주항쟁 기념식 공연에 이랑과 늑대의  하울링 이 필요한 이유 위근우의 리플레이 ,Culture
 이태원 참사  큰 슬픔 앞에 우리가 해도 되는 건 웃지 않는 것뿐일까 위근우의 리플레이 ,Culture
이찬혁  에러  퍼포먼스를 이해 않으려는 낡은 권위의식  그게  에러  위근우의 리플레이 ,Culture
한동훈 장관이 정말로 만화 공모전 심사위원이었다면  위근우의 리플레이 ,Culture
  광저우 봉쇄지역 주민들도 탈출 철조망 등 넘어,World
중국 봉쇄 장기화에 항의 시위 이어 탈출극 참다못한 주민들 대거 봉쇄지역 이탈,World
 봉쇄망 뚫고 집단 탈주도    한계 보이는 중국 제로코로나,World
제로 코로나에 중국인들 인내심 바닥  광저우서 대규모 탈출 발생,World
우크라  러시아군에 자폭드론 사용법 가르치던 이란인 교관들 크림반도에서 살해 ,World
 영상  우크라  이란  자폭 드론  교관 살해 시인 전범 책임론 대두,World
우크라  크름반도 내  러 자폭 드론  이란 교관들 살해 ,World
우크라  크림반도서 러에  자폭드론  가르치던 이란인 살해 ,World
머스크  트위터  월드컵 기간에 초당  만 개 업로드  최고 기록  ,World
트위터  벨기에 브뤼셀 직원 전원 퇴사로    규제 대응에  비상 ,World
우리나라 주  시간제  트위터코리아 고용 중단 시킬까,World
 머스크의 역설  트위터  벨기에 브뤼셀 직원 전원 퇴사,World
바이낸스  최대   조 천억원 복구기금 계획 업계 불안 여전,World
바이낸스      붕괴 후폭풍 확산 막겠다   억 달러 기금 조성 ,World
애플  공장  레미제라블  시위 폭스콘  퇴사하면    만원 ,World
 폭스콘  시위 벌인 신규 노동자에  즉시 떠나면    만원 줄게 ,World
홋카이도  후지산  난세이 제도    장사정 미사일 배치  나선다,World
일본  중 러 한반도 사정거리  장사정 미사일 배치  검토,World
   정부 건물에        설치 중단 국가 안보에 위협,World
   중국산 감시카메라 퇴출   국가 안보 위험 ,World
머스크  다음주부터 활동정지 계정 복구  지옥문 열린다 ,World
머스크  다음주부터 사용 중단 트위터 계정 사면키로,World
이란 국가대표 출신 유명 축구선수   정권 비판  했다가 체포,World
중국  유엔서 이란 히잡시위 진상조사 막으려 했지만 실패,World
장제스 증손자    방역 사령탑  타이베이시장 빅매치,World
대만 지방선거  초점은 타이베이로 장제스 증손자    전 복지부 장관 격돌,World
    가스값 상한제 또 합의 실패     유로 기준  놓고 충돌,World
에너지난     천연가스 공동구매 합의  러시아산은 제외 ,World
시진핑  베트남 쿠바 라오스 정상 초청   매체  사회주의 연대 강화 ,World
  시진핑  대외활동 재개 쿠바 대통령과 회담,World
홋카이도 시골 마을에 도쿄 부촌급 문화시설 빼곡한 비결  정영효의 인사이드 재팬 ,World
 안 가본 사람은 있어도 한 번 가본 사람은 없다 는  마을  정영효의 인사이드 재팬 ,World
 육아천국  소문나자 이주자 줄섰다  시골마을 부활 비결  정영효의 인사이드 재팬 ,World
 은퇴자보다 젊은세대에 인기  이주민 몰린  마을의 사연  정영효의 인사이드 재팬 ,World
      플레이어 위한 특별 이벤트  신바람 탈 샤코의 선물  진행,IT
 문화재 지킴이    주년 라이엇 롤에 전통탈 쓴  샤코  나온다,IT
라이엇게임즈  코리아 사랑       한국 유저에만 특별한 선물,IT
라이엇게임즈  경복궁 찾아 문화유적지 청정활동 전개,IT
게임 관련 분쟁 급증  콘텐츠분쟁조정위 기능 확대해야,IT
개인정보위  분쟁조정위원장에 이인호 중앙대 교수 위촉,IT
개인정보위 분쟁조정위원장에 이인호 중앙대 교수,IT
이인호 중앙대 교수  개인정보 분쟁조정위원장 위촉,IT
 메타버스 그루밍 막는다   제페토 신고기능 강화,IT
네이버제트  신고기능 강화 안티그루밍으로 이용자 보호 ,IT
엔씨소프트  국내 최대 규모         챌린지   위,IT
엔씨소프트  국내 최대         챌린지  최종  위 올라,IT
대한민국 공익광고제 대상에 디지털 약자 다룬  현실 편,IT
방통위  대한민국 공익광고제 개최 대상은 디지털약자 조명한  현실 ,IT
 우루과이전  광화문 대신 네이버 응원 오픈톡으로     만명 몰려,IT
 우루과이전 값진 무승부  네이버 응원톡에    만명 몰려,IT
신종감염병 백신 연구  인도 중국에 한참 뒤졌다,IT
우리나라 감염병 백신연구수준 세계      위에 불과,IT
지구 주인 행세한 인간이 간과한  보이지 않는 손  전문가의 세계   김응빈의 미생물  수다  ,IT
이성보다 꿈을  현실보다 상상을 복잡한 세계에서 길을 찾는 방법 전문가의 세계   박주용의 퓨처라마 ,IT
실험으로 증명된 양자역학 아인슈타인의  위대한 직관 에 패배 안기다 전문가의 세계   이종필의 과학자의 발상법 ,IT
살아남으려는  먹힌 놈 과 소화불량  포식자 의 사투 공생  시작은 경쟁이었다 전문가의 세계   김응빈의 미생물  수다  ,IT
 접속은 신속  화질은 향상  추천은 똑똑  티빙     경험 확 바꾼다     온에어 ,IT
세제지원  동상이몽     업계  투자비도 세액공제  한목소리     온에어 ,IT
     전용관  만든             선언                공생      온에어 ,IT
민 관 연   미디어 급변  공감  전략로드맵 구축  숙제      온에어 ,IT
